34,NJ,34,Washington Borough,Municipal,11/8/2016,"5-year, 2 cents per $100 property tax increase for open space and recreation",Property tax,,"Open space, recreation, watershed protection",371205,371205,371205,371205,yes,Pass,0.502101822,0.497898178,Warren County,TPL,yes,7,1066,1075,10192,3477270,,2141,371205,371205,,,NJ
34,NJ,34,Wyckoff Township,Municipal,11/8/2016,"5-year, .5 cent per $100 property tax renewal for the preservation of open space",Property tax,,"Open space, recreation",1155225,1155225,1155225,1155225,yes,Pass,0.76231319,0.23768681,Bergen County,,yes,7,1829,5866,10197,3483080,,7695,1155225,1155225,,,NJ
34,NJ,34,Robbinsville Township,Municipal,11/8/2016,1.5 cent per $100 property tax increase for open space,Property tax,,"Open space, recreation, farmland",7316017,7316017,7316017,7316017,yes,Pass,0.65259009,0.34740991,"Mercer County, Prior to 2008 this Robbinsville Township was known as Washington Township",,yes,7,2468,4636,10205,3477510,,7104,7316017,7316017,,,NJ
34,NJ,34,Northvale Borough,Municipal,11/8/2016,"5-year, 1 cent per $100 property tax increase to establish an open space trust fund",Property tax,,"Open space, recreation",415000,415000,,,no,Fail,0.441495778,0.558504222,Bergen County,,yes,7,926,732,10206,3453430,,1658,0,415000,,,NJ
34,NJ,34,East Amwell Township,Municipal,11/8/2016,,Other,,,,,,,yes,Pass,0.726801696,0.273198304,Hunterdon County,TPL,yes,10,580,1543,10213,3401918820,,2123,0,0,,,NJ
34,NJ,34,Harvey Cedars,Municipal,11/8/2016,1 cent per $100 property tax increase for open space,Property tax,,Open space,2400000,2400000,2400000,2400000,yes,Pass,0.546428571,0.453571429,Ocean County,,yes,7,127,153,10221,3430390,,280,2400000,2400000,,,NJ
34,NJ,34,Jersey City,Municipal,11/8/2016,Up to 2 cents per $100 property tax increase for open space and recreational purposes,Property tax,,"Open space, recreation, parks",24000000,24000000,24000000,24000000,yes,Pass,0.616201644,0.383798356,"Hudson County, Question 2",TPL,yes,7,11816,18971,10222,3436000,,30787,24000000,24000000,,,NJ
34,NJ,34,Fanwood Borough,Municipal,11/8/2016,"1 cent per $100 property tax increase for open space, parks and recreation",Property tax,,"Open space, recreation, parks, farmland",456976,456976,456976,456976,yes,Pass,0.580115037,0.419884963,"Union County, Question 4",,yes,7,1533,2118,10223,3422860,,3651,456976,456976,,,NJ
34,NJ,34,Colts Neck Township,Municipal,11/8/2016,1.3 cent per $100 property tax increase for open space and farmland preservstion,Property tax,,"Open space, farmland",14000000,14000000,,,no,Fail,0.40828751,0.59171249,Monmouth County,,yes,10,3013,2079,10225,3402514560,,5092,0,14000000,,,NJ
34,NJ,34,Tenafly Borough,Municipal,11/8/2016,"10-year, 1cent continuation of open space tax",Property tax,,"Open space, recreation",3900000,3900000,3900000,3900000,yes,Pass,0.579949239,0.420050761,Bergen County,,yes,7,1655,2285,10236,3472420,,3940,3900000,3900000,,,NJ
34,NJ,34,Teaneck Township,Municipal,11/8/2016,4-year. continuation of 1 cent per $100 property tax for the acquisition of open space and recreational lands,Property tax,,"Open space, recreation",2008445,2008445,2008445,2008445,yes,Pass,0.576611561,0.423388439,Bergen County,,yes,7,3816,5197,10237,3472390,,9013,2008445,2008445,,,NJ
34,NJ,34,Oldmans Township,Municipal,11/8/2016,Up to 3 cents per $100 property tax to create an open space trust fund,Property tax,,"Open space, recreation, farmland",466233,466233,466233,466233,yes,Pass,0.520812183,0.479187817,Salem County,,yes,10,472,513,10239,3403354810,,985,466233,466233,,,NJ
34,NJ,34,Union County,County,11/8/2016,1.5 cents per $100 extension of property tax for  for open space trust fund,Property tax,,"Open space, recreation",70391880,70391880,70391880,70391880,yes,Pass,0.581158587,0.418841413,Question 3,,yes,5,59736,82886,10246,34039,34039,142622,70391880,70391880,,,NJ
34,NJ,34,Secaucus,Municipal,11/8/2016,1 cent per $100 property tax increase for open space and farmland,Property tax,,"Open space, recreation, farmland",5113236,5113236,5113236,5113236,yes,Pass,0.610922113,0.389077887,Hudson County,,yes,7,2173,3412,10259,3466570,,5585,5113236,5113236,,,NJ
34,NJ,34,Beach Haven Borough,Municipal,11/8/2016,1 cent per $100 property tax increase for open space acquisition and development,Property tax,,"Open space, recreation",3343331,3343331,,,no,Fail,0.466876972,0.533123028,Ocean County,,yes,7,338,296,10260,3403940,,634,0,3343331,,,NJ
35,NM,35,Albuquerque,Municipal,10/28/2003,"Parks and Recreation Bonds, Bonds for acquisition and improvement of park, recreational facilities",Bond,,"parks, recreation",32548197,3439000,32550000,3440000,yes,Pass,0.599048374,0.400951626,,,yes,7,20224,30216,6690,3502000,,50440,3440000,3439000,,,NM
35,NM,35,Gallup,Municipal,8/12/2003,"Public Parks and Recreation Bond Question, Bond for parks, trails, playgrounds, public recreational facilities",Bond,,"parks, trails, recreation",4190000,1000000,4190000,1000000,yes,Pass,0.760646109,0.239353891,,TPL,yes,7,326,1036,6691,3528460,,1362,1000000,1000000,,,NM
35,NM,35,Santa Fe County,County,4/9/2002,"Capital Outlay Tax; .25% gross receipts tax for open space, trails, waste and wastewater programs",Sales tax,,"open space, trails, watershed protection",24000000,3600000,24000000,3600000,yes,Pass,0.768849411,0.231150589,,"TPL, TCC",yes,5,1119,3722,6692,35049,35049,4841,3600000,3600000,,,NM
35,NM,35,Santa Fe County,County,11/7/2000,Bond issue to acquire real estate and easements for open space,Bond,,Open space,8000000,8000000,8000000,8000000,yes,Pass,0.695236545,0.304763455,,"TPL, TCC",yes,5,13103,29891,6693,35049,35049,42994,8000000,8000000,,,NM
35,NM,35,Bernalillo County,County,11/7/2000,"6-year, .25 mill property tax extension to acquire and maintain land for open space",Property tax,,open space,25000000,25000000,25000000,25000000,yes,Pass,0.677565297,0.322434703,,"TPL, TCC",yes,5,59367,124754,6694,35001,35001,184121,25000000,25000000,2006,,NM
35,NM,35,Bernalillo County,County,11/7/2000,Bond issue to acquire land and expand parks and recreational facilities,Bond,,open space,1576000,1576000,1576000,1576000,yes,Pass,0.697771263,0.302228737,,,yes,5,55666,128519,6695,35001,35001,184185,1576000,1576000,,,NM
35,NM,35,Bernalillo County,County,11/3/1998,"Mill Levy Question, 2-year, 0.5 mill property tax increase for open space",Property tax,,Open space,7000000,7000000,7000000,7000000,yes,Pass,0.567965648,0.432034352,,TPL,yes,5,62683,82405,6696,35001,35001,145088,7000000,7000000,2000,,NM
35,NM,35,New Mexico,State,11/3/1998,"Bond for ecologically signficant land, wildlife, open space",Bond,,"open space, wildlife habitat",620000,620000,,,no,Fail,0.481022486,0.518977514,,,yes,2,215918,200127,6697,35,35,416045,0,620000,,,NM
35,NM,35,Santa Fe County,County,11/3/1998,"Bond for Open Space, Trails, Recreation, Parks, Wildlife",Bond,,"Recreation, parks, trails, open space, wildlife habitat",12000000,12000000,12000000,12000000,yes,Pass,0.701537942,0.298462058,,TPL,yes,5,8830,20755,6972,35049,35049,29585,12000000,12000000,,,NM
35,NM,35,Bernalillo County,County,11/3/1998,"Parks and Recreational Facilities Bond, Bond for Parks, Recreation",Bond,,"recreation, parks",3370000,660000,3370000,660000,yes,Pass,0.681688033,0.318311967,,,yes,5,46803,100232,6973,35001,35001,147035,660000,660000,,,NM
35,NM,35,New Mexico,State,11/5/1996,"Constitutional Amendment 7, authorizes counties to issue bonds to acquire open space lands",Other,Debt Authorization,Open Space,,,,,yes,Pass,0.50128306,0.49871694,No $ for acquisition,,no,2,227580,228751,7010,35,35,456331,0,0,,,NM
35,NM,35,Corrales,Municipal,8/31/2004,Bond for the purchase of conservation easements for farmland,Bond,,Farmland,2500000,2500000,2500000,2500000,yes,Pass,0.832271762,0.167728238,Sandoval County,TPL,yes,7,237,1176,7265,3517960,,1413,2500000,2500000,,,NM
35,NM,35,Albuquerque,Municipal,1/14/1997,"2-year, quarter of a percent municipal gross tax",Sales tax,,"Parks, open space",45000000,45000000,45000000,45000000,yes,Pass,0.601653514,0.398346486,"Mail in ballot, Aprox. $65/year per family",,yes,7,31800,48030,7670,3502000,,79830,45000000,45000000,1999,,NM
35,NM,35,New Mexico,State,11/8/1988,"Bond for Natural Land Protection Fund- wildlife, endangered species and natural areas",Bond,,"Open space, wildlife habitat",425000,425000,425000,425000,yes,Pass,0.620690049,0.379309951,,,yes,2,132705,217154,7893,35,35,349859,425000,425000,,,NM
35,NM,35,New Mexico,State,11/6/1990,Bond for land preservation,Bond,,"Open space, wildlife habitat",225000,225000,,,no,Fail,0.462512952,0.537487048,,,yes,2,164958,141948,7894,35,35,306906,0,225000,,,NM
35,NM,35,New Mexico,State,11/3/1992,Bond for state parks,Bond,,Parks,1550000,500000,,,no,Fail,0.491413613,0.508586387,,,yes,2,233136,225264,7895,35,35,458400,0,500000,,,NM
35,NM,35,Bernalillo,Municipal,3/7/2006,1/8 of 1% gross receipts tax increase for open space and water rights acquisition ,Sales tax,,"Open space, watershed protection, farmland",1700000,1700000,1700000,1700000,yes,Pass,0.781595092,0.218404908,Sandoval County,,yes,7,178,637,9290,3506970,,815,1700000,1700000,,,NM
35,NM,35,Village of Los Ranchos de Albuquerque,Municipal,3/13/2007,Bond for the purchase of open space and trails,Bond,,"Open space, trails",3600000,3600000,3600000,3600000,yes,Pass,0.652430044,0.347569956,Bernalillo County,"TPL, TCC",yes,7,472,886,9533,3543930,,1358,3600000,3600000,,,NM
35,NM,35,Albuquerque,Municipal,10/2/2007,Bond for parks and recreation capital improvements including land acquisition,Bond,,"Parks, recreation, open space",37491000,6000000,37491000,6000000,yes,Pass,0.655021538,0.344978462,,,yes,7,10171,19312,9599,3502000,,29483,6000000,6000000,,,NM
35,NM,35,Santa Fe,Municipal,3/4/2008,"Bond for the improvement and acquisition of parks, trails and open space",Bond,,"Parks, trails, open space",30300000,2900000,30300000,2900000,yes,Pass,0.705087353,0.294912647,,"TPL, TCC",yes,7,2684,6417,9656,3570500,,9101,2900000,2900000,,,NM
35,NM,35,Santa Fe County,County,11/4/2008,"Bond for parks, open space, and trail acquisitions and improvements",Bond,,"Parks, open space, trails",3500000,3500000,3500000,3500000,yes,Pass,0.669696878,0.330303122,Question 1,,yes,5,21728,44054,9776,35049,35049,65782,3500000,3500000,,,NM
35,NM,35,Bernalillo County,County,11/4/2014,"15-year, .20 mill property tax levy for open space and other natural areas acquisition and maintenance",Property tax,,"Open space, parks, trails, recreation, forests, farmland, watershed protection, wildlife habitat",41804640,28845202,41804640,28845202,yes,Pass,0.724066063,0.275933937,,"TPL, TCC",yes,5,43823,114994,10056,35001,35001,158817,41804640,41804640,,,NM
32,NV,32,Douglas County,County,11/7/2000,Sales tax increase for preservation of open space and purchase of development rights,Sales tax,,"open space, farmland",34800000,34800000,,,no,Fail,0.441681401,0.558318599,,"TPL, TCC",yes,5,9789,7744,6699,32005,32005,17533,0,34800000,,,NV
32,NV,32,Nevada,State,11/5/2002,Question 1; bond for to preserve water quality and protect wildlife habitat and open space.,Bond,,"watershed protection, open space",200000000,89500000,200000000,89500000,yes,Pass,0.592712732,0.407287268,,"TPL, TCC",yes,2,200143,291262,6700,32,32,491405,89500000,89500000,,,NV
32,NV,32,Washoe County,County,11/7/2000,"Bond issue for acquiring, improving, and equipping parks, trails, open space, library",Bond,,"parks, trails, recreation",38300000,28300000,38300000,28300000,yes,Pass,0.535579094,0.464420906,,"TPL, TCC",yes,5,54719,63103,6701,32031,32031,117822,28300000,28300000,,,NV
32,NV,32,Carson City,Municipal,11/5/1996,"Question 18, 0.25 of 1 Percent Sales Tax Increase for Parks, Open Space, Trails, Recreation",Sales tax,,"open space, recreation, trails, parks",15000000,5000000,15000000,5000000,yes,Pass,0.52614361,0.47385639,,TPL,yes,7,8546,9489,7009,3209700,,18035,5000000,5000000,,,NV
32,NV,32,Washoe County,County,11/2/2004,"30-year, 1/8% sales tax increase for open space",Sales tax,,Open space,,,,,no,Fail,0.482404476,0.517595524,Advisory Question,,yes,5,77159,71913,7270,32031,32031,149072,0,0,,,NV
32,NV,32,Douglas County,County,11/5/1996,"Douglas County Question No. 2, 1/4 cent sales/use tax increase for parks, Open space, Trails, Recreation",Sales tax,,"Recreation, open space, parks, trails",,,,,no,Fail,0.388440148,0.611559852,,,yes,5,9237,5867,7511,32005,32005,15104,0,0,,,NV
32,NV,32,Moapa,Municipal,11/8/1994,Bonds for parks,Bond,,Parks,800000,800000,800000,800000,yes,Pass,0.665254237,0.334745763,,,yes,7,79,157,7879,3247840,,236,800000,800000,,,NV
32,NV,32,Moapa,Municipal,11/8/1988,40 years- 4% of property tax,Property tax,,"Parks, recreation",1600000,1600000,1600000,1600000,yes,Pass,0.691428571,0.308571429,Clark County,,yes,7,54,121,7891,3247840,,175,1600000,1600000,2028,,NV
32,NV,32,Nevada,State,11/6/1990,"Question No.5-Bond for parks, wetlands and wildlife resources",Bond,,"wildlife habitat, parks",47200000,47200000,47200000,47200000,yes,Pass,0.659657846,0.340342154,,,yes,2,106911,207217,7902,32,32,314128,47200000,47200000,,,NV
36,NY,36,North Salem,Municipal,11/7/2000,Bond issue for acquisition of land and conservation easements,Bond,,"open space, farmland",2000000,2000000,2000000,2000000,yes,Pass,0.69924812,0.30075188,,TPL,yes,10,600,1395,6704,3611953517,,1995,2000000,2000000,,,NY
36,NY,36,Red Hook,Municipal,10/7/2003,"Bond for open space, farmland",Bond,,"open space, farmland",3500000,3500000,3500000,3500000,yes,Pass,0.828254848,0.171745152,,,yes,10,186,897,6705,3602760905,,1083,3500000,3500000,,,NY
36,NY,36,Livonia,Municipal,5/23/2003,Bond to expand park,Bond,,parks,600000,600000,,,no,Fail,0.494969819,0.505030181,Livingston County,,yes,10,251,246,6706,3605142961,,497,0,600000,,,NY
36,NY,36,Huntington,Municipal,11/4/2003,"Bond for open space, park improvements",Bond,,"open space, parks",30000000,20000000,30000000,20000000,yes,Pass,0.660859466,0.339140534,,,yes,10,9052,17639,6707,3610337000,,26691,20000000,20000000,,,NY
36,NY,36,Goshen,Municipal,11/4/2003,"Bond for open space, farmland",Bond,,"open space, farmland",10000000,10000000,,,no,Fail,0.462633452,0.537366548,,,yes,10,1510,1300,6708,3607129553,,2810,0,10000000,,,NY
36,NY,36,Suffolk County,County,11/2/1999,"Proposition 2, .25 percent sales tax extension for drinking water",Sales tax,,Watershed protection,140000000,140000000,140000000,140000000,yes,Pass,0.878390851,0.121609149,,TPL,yes,5,10145,73278,6710,36103,36103,83423,140000000,140000000,,,NY
36,NY,36,Southold,Municipal,11/2/1999,"Proposition 1, Bond for open space, farmland, easements",Bond,,"Open space, farmland",2000000,2000000,2000000,2000000,yes,Pass,0.576096962,0.423903038,,,yes,10,2763,3755,6711,3610369463,,6518,2000000,2000000,,,NY
36,NY,36,Brookhaven,Municipal,11/2/1999,"Proposal 6, Bond for open space, drinking water, farmland easements, environmentally sensitive areas",Bond,,"Open space, watershed protection, farmland",10000000,10000000,10000000,10000000,yes,Pass,0.703168924,0.296831076,,,yes,10,13938,33018,6712,3610310000,,46956,10000000,10000000,,,NY
36,NY,36,Lewisboro,Municipal,11/7/2000,Bond issue for open space preservation,Bond,,open space,2000000,2000000,2000000,2000000,yes,Pass,0.791915571,0.208084429,Westchester County,TPL,yes,10,1045,3977,6713,3611942136,,5022,2000000,2000000,,,NY
36,NY,36,Bedford,Municipal,11/7/2000,Property tax levy to acquire and maintain open space and parks through a dedicated fund,Property tax,,open space,1601730,1601730,1601730,1601730,yes,Pass,0.706970895,0.293029105,,TPL,yes,10,1631,3935,6714,3611905320,,5566,1601730,1601730,,,NY
36,NY,36,North Hempstead,Municipal,11/7/2000,"Bond issue to establish a dedicated fund for open space acquisition, restoration of environmentally sensitive areas, and improvement of coastal areas.",Bond,,Open space,15000000,15000000,15000000,15000000,yes,Pass,0.708930712,0.291069288,,"TPL, TCC",yes,10,13115,31943,6715,3605953000,,45058,15000000,15000000,,,NY
36,NY,36,Clarkstown,Municipal,11/7/2000,Bond issue for acquisition of properties or interests in open space,Bond,,open space,22000000,22000000,22000000,22000000,yes,Pass,0.556907541,0.443092459,Rockland County,TPL,yes,10,10706,13456,6716,3608715968,,24162,22000000,22000000,,,NY
36,NY,36,Irvington,Municipal,11/7/2000,Bond issue for open space acquisition,Bond,,open space,3000000,3000000,3000000,3000000,yes,Pass,0.834069908,0.165930092,Westchester County,TPL,yes,7,413,2076,6717,3637803,,2489,3000000,3000000,,,NY
36,NY,36,Somers,Municipal,11/7/2000,Bond issue for land acquisition,Bond,,open space,2000000,2000000,2000000,2000000,yes,Pass,0.675769989,0.324230011,,TPL,yes,10,2137,4454,6718,3611968308,,6591,2000000,2000000,,,NY
36,NY,36,Pound Ridge,Municipal,11/7/2000,"10-year, 0.1 mill, property tax increase for open space protection",Property tax,,open space,3000000,3000000,3000000,3000000,yes,Pass,0.528946272,0.471053728,Westchester County,TPL,yes,10,1131,1270,6719,3611959685,,2401,3000000,3000000,2010,2010,NY
36,NY,36,Oyster Bay,Municipal,11/7/2000,Bond issue for acquisition and improvement of land for open space preservation and recreation,Bond,,"open space, parks, recreation",30000000,30000000,30000000,30000000,yes,Pass,0.686762832,0.313237168,,"TPL, TCC",yes,10,22866,50133,6720,3605956000,,72999,30000000,30000000,,,NY
36,NY,36,Brighton,Municipal,12/17/2002,Bond measure for open space acquisition and parkland,Bond,,"open space, parks",5000000,5000000,5000000,5000000,yes,Pass,0.799110198,0.200889802,Monroe County,,yes,10,587,2335,6721,3603308213,,2922,5000000,5000000,,,NY
36,NY,36,Southold,Municipal,11/6/2001,Bond for acquisition and preservation of open space and agricultural lands,Bond,,"open space, farmland",2000000,2000000,2000000,2000000,yes,Pass,0.620150763,0.379849237,,,yes,10,2066,3373,6722,3610369463,,5439,2000000,2000000,,,NY
36,NY,36,East Hampton,Municipal,11/6/2001,Bond for open space acquisition,Bond,,Open space,5000000,5000000,5000000,5000000,yes,Pass,0.640085787,0.359914213,,,yes,10,1846,3283,6723,3610322194,,5129,5000000,5000000,,,NY
36,NY,36,Brookhaven,Municipal,11/5/2002,Bond for open space protection,Bond,,open space,20000000,20000000,20000000,20000000,yes,Pass,0.711713926,0.288286074,,"TPL, TCC",yes,10,18768,46334,6724,3610310000,,65102,20000000,20000000,,,NY
36,NY,36,Clarence,Municipal,11/5/2002,Bond for farmland development rights and open space,Bond,,"farmland, open space",12500000,12500000,12500000,12500000,yes,Pass,0.634954008,0.365045992,Erie County,,yes,10,2778,4832,6725,3602915825,,7610,12500000,12500000,,,NY
36,NY,36,East Hampton,Municipal,11/5/2002,2% tax extension on real estate transactions to protect open space,Real estate transfer tax,,open space,95000000,95000000,95000000,95000000,yes,Pass,0.706840974,0.293159026,,,yes,10,1637,3947,6726,3610322194,,5584,95000000,95000000,,,NY
36,NY,36,Webster,Municipal,4/9/2002,Bond for open space and farmland,Bond,,"Open space, farmland",22500000,22500000,,,no,Fail,,,"42/58
Monroe County",,yes,10,,,6727,3605578971,,,0,22500000,,,NY
36,NY,36,Southold,Municipal,11/5/2002,10-year; 2% tax extension on real estate transactions to protect open space,Real estate transfer tax,,open space,29556360,29556360,29556360,29556360,yes,Pass,0.713617685,0.286382315,,,yes,10,2021,5036,6728,3610369463,,7057,29556360,29556360,2012,,NY
36,NY,36,Southampton,Municipal,11/5/2002,10-year; 2% tax extension from 2010-2020 on real estate transactions to protect open space,Real estate transfer tax,,open space,200000000,200000000,200000000,200000000,yes,Pass,0.693079475,0.306920525,,,yes,10,3885,8773,6729,3610368473,,12658,200000000,200000000,2012,,NY
36,NY,36,New Castle,Municipal,11/5/2002,Bond to acquire open space land,Bond,,open space,2000000,2000000,2000000,2000000,yes,Pass,0.743197279,0.256802721,,,yes,10,906,2622,6730,3611950078,,3528,2000000,2000000,,,NY
36,NY,36,Saratoga Springs,Municipal,11/5/2002,"Land Conservation Bond; Bond to acquire environmentally sensitive areas, farmland and parkland",Bond,,"farmland, parks",5000000,5000000,5000000,5000000,yes,Pass,0.740468535,0.259531465,,TPL,yes,10,1695,4836,6731,3609165255,,6531,5000000,5000000,,,NY
36,NY,36,Riverhead,Municipal,11/5/2002,10-year; 2% tax extension on real estate transactions to protect open space,Real estate transfer tax,,open space,30000000,30000000,30000000,30000000,yes,Pass,0.716890882,0.283109118,,,yes,10,1894,4796,6732,3610361984,,6690,30000000,30000000,2012,,NY
36,NY,36,Penfield,Municipal,4/23/2002,Bond to Purchase development rights to farms,Bond,,Farmland,10000000,10000000,10000000,10000000,yes,Pass,0.671379815,0.328620185,Monroe County,,yes,10,1348,2754,6733,3605557144,,4102,10000000,10000000,,,NY
36,NY,36,Orangetown,Municipal,11/5/2002,Bond to acquire 348-acre parcel,Bond,,open space,6950000,6950000,6950000,6950000,yes,Pass,0.716460514,0.283539486,,,yes,10,2980,7530,6734,3608755211,,10510,6950000,6950000,,,NY
36,NY,36,Ardsley Village,Municipal,11/6/2001,Proposal 3; Bond for open space and park land acquisition,Bond,,"open space, parks",1750000,1750000,1750000,1750000,yes,Pass,0.7141339,0.2858661,,,yes,7,269,672,6735,3602506,,941,1750000,1750000,,,NY
36,NY,36,Dobbs Ferry,Municipal,11/6/2001,Bond for acquisition and preservation of open space and parks,Bond,,"open space, parks",3000000,3000000,3000000,3000000,yes,Pass,0.752528658,0.247471342,,,yes,7,367,1116,6736,3620698,,1483,3000000,3000000,,,NY
36,NY,36,Shelter Island,Municipal,11/5/2002,10-year; 2% tax extension on real estate transactions to protect open space,Real estate transfer tax,,open space,5385254,5385254,5358254,5358254,yes,Pass,0.768376068,0.231623932,,,yes,10,271,899,6737,3610366839,,1170,5358254,5385254,2012,,NY
36,NY,36,Yorktown,Municipal,11/7/2000,Per lot charge to create an open space and conservation district,Property tax,,open space,8000000,8000000,8000000,8000000,yes,Pass,0.643766578,0.356233422,,"TPL, TCC",yes,10,4029,7281,6738,3611984077,,11310,8000000,8000000,,,NY
36,NY,36,Warwick,Municipal,11/7/2000,Bond issue for local PDR program and acquisition of open space,Bond,,open space,9500000,9500000,9500000,9500000,yes,Pass,0.522369311,0.477630689,,,yes,10,4943,5406,6739,3607178366,,10349,9500000,9500000,,,NY
36,NY,36,Wilton,Municipal,6/26/2001,$3 million bond to protect open space resources,Bond,,open space,3000000,3000000,,,no,Fail,0.429581615,0.570418385,Saratoga County,,yes,10,968,729,6740,3609182403,,1697,0,3000000,,,NY
36,NY,36,Tarrytown,Municipal,3/20/2001,Open space proposition; Bond for land acquisition and open space,Bond,,Open space,3000000,3000000,3000000,3000000,yes,Pass,0.760210804,0.239789196,,TPL,yes,7,546,1731,6741,3673176,,2277,3000000,3000000,,,NY
36,NY,36,New York,State,11/5/1996,"Proposal 1, The Clean Water/Clean Air Bond Act of 1996, Bond for Preservation of State's Natural Resources",Bond,,"Open Space, Watershed Protection, wildlife habitat, Farmland, Recreation, Parks, Trails, Greenways, forests",1750000000,150000000,1750000000,150000000,yes,Pass,0.566560049,0.433439951,,TPL,yes,2,1748925,2286063,7011,36,36,4034988,150000000,150000000,,,NY
36,NY,36,Webster,Municipal,4/27/2004,"Bond for open space, wildlife, trails, farmland, easements",Bond,,"Open space, wildlife habitat, farmland, trials",5900000,5900000,5900000,5900000,yes,Pass,0.522249522,0.477750478,Monroe County,"TPL, TCC",yes,10,1750,1913,7023,3605578971,,3663,5900000,5900000,,,NY
36,NY,36,Southold,Municipal,11/5/1996,"Proposal 5, Bond for Farmland, Open Space",Bond,,"farmland, open space",2000000,2000000,2000000,2000000,yes,Pass,0.67123593,0.32876407,,,yes,10,2950,6023,7047,3610369463,,8973,2000000,2000000,,,NY
36,NY,36,Southampton,Municipal,11/3/1998,"Town Proposition No. 1, 2 Percent Real Estate Transfer Tax Increase for Open Space, Historic Preservation",Real estate transfer tax,,open space,19953154,14414172,19953154,14414172,yes,Pass,0.603794574,0.396205426,,,yes,10,6411,9770,7070,3610368473,,16181,14414172,14414172,,,NY
36,NY,36,Huntington,Municipal,11/3/1998,"Town Proposition No. 1, Bond for Open Space, Parks",Bond,,"open space, parks",15000000,10000000,15000000,10000000,yes,Pass,0.722502547,0.277497453,Suffolk County,,yes,10,11714,30499,7071,3610337000,,42213,10000000,10000000,,,NY
36,NY,36,Shelter Island,Municipal,11/3/1998,"Town Proposition No. 1, 2 Percent Real Estate Transfer Tax Increase for Open Space, Historic Preservation",Real estate transfer tax,,open space,749694,741158,749694,741158,yes,Pass,0.705521472,0.294478528,,,yes,10,384,920,7072,3610366839,,1304,741158,741158,,,NY
36,NY,36,East Hampton,Municipal,11/3/1998,"Town Proposition No. 1, 2 Percent Real Estate Transfer Tax Increase for Open Space, Historic Preservation",Real estate transfer tax,,open space,6780605,6780605,6780605,6780605,yes,Pass,0.668072727,0.331927273,,,yes,10,2282,4593,7073,3610322194,,6875,6780605,6780605,,,NY
36,NY,36,Southold,Municipal,11/3/1998,"Town Proposition No. 1, Bond for Open Space, Conservation of Natural Resources",Bond,,"open space,",2000000,2000000,2000000,2000000,yes,Pass,0.6316435,0.3683565,,,yes,10,2703,4635,7074,3610369463,,7338,2000000,2000000,,,NY
36,NY,36,Southold,Municipal,11/3/1998,"Town Proposition No. 2, 2 Percent Real Estate Transfer Tax Increase for Open Space, Historic Preservation",Real estate transfer tax,,open space,1039500,935550,1039500,935550,yes,Pass,0.587173579,0.412826421,,,yes,10,3225,4587,7075,3610369463,,7812,935550,935550,,,NY
36,NY,36,Suffolk County,County,11/3/1998,"Proposition No. 3, Bond for Farmland, Parks, Recreation, Natural History Center",Bond,,"recreation, open space, farmland, parks",62000000,59400000,62000000,59400000,yes,Pass,0.658747375,0.341252625,,,yes,5,79288,153056,7076,36103,36103,232344,59400000,59400000,,,NY
36,NY,36,Greenburgh,Municipal,11/4/1997,"Proposition No. 1, 6-year, .5% Property Tax Increase to Establish the Greenways Fund for Open Space, Parks",Property tax,,"open space, parks",813288,813288,813288,813288,yes,Pass,0.618144479,0.381855521,Westchester County,TPL,yes,10,3161,5117,7114,3611930367,,8278,813288,813288,2003,,NY
