17,IL,17,Lemont Township,Municipal,4/3/2001,"Bonds for acquisition, maintenance, development, and renovation of open space lands",Bond,,Open space,10000000,10000000,10000000,10000000,yes,Pass,0.622989875,0.377010125,Cook County,,yes,10,1266,2092,6266,1703142808,,3358,10000000,10000000,,,IL
17,IL,17,Campton Township,Municipal,4/3/2001,Bond for land acquisition,Bond,,open space,18765000,18765000,18765000,18765000,yes,Pass,0.539076606,0.460923394,Kane County,,yes,10,1787,2090,6267,1708910903,,3877,18765000,18765000,,,IL
17,IL,17,Plainfield Township Park District,Special District,4/1/2003,"Proposition to Issue General Obligation Bonds, Bond for bike trails, soccer fields, public facilities",Bond,,"trails, recreation",13000000,7500000,,,no,Fail,0.443938442,0.556061558,Will and Kendall Counties,,yes,0,3541,2827,6268,,,6368,0,7500000,,,IL
17,IL,17,New Lenox Community Park District,Special District,4/1/2003,"Proposition to Issue General Obligation Bonds, Bond for acquiring, maintaining, improving park land",Bond,,parks,7750000,7750000,,,no,Fail,0.293090357,0.706909643,Will County,,yes,0,3724,1544,6269,,,5268,0,7750000,,,IL
17,IL,17,Huntley Park District,Special District,4/1/2003,"Proposition to Issue Park Bonds, Bond for acquisition of land for golf course",Bond,,recreation,5700000,5700000,5700000,5700000,yes,Pass,0.542040223,0.457959777,McHenry and Kane Counties,,yes,0,1890,2237,6270,,,4127,5700000,5700000,,,IL
17,IL,17,Libertyville,Municipal,2/23/1999,Bond for open space,Bond,,Open space,37000000,37000000,,,no,Fail,0.459370904,0.540629096,Lake County,,yes,10,3300,2804,6271,1709743263,,6104,0,37000000,,,IL
17,IL,17,Rockford Park District,Special District,4/1/2003,".225% property tax for safety, maintenance, acquisition of parkland",Property tax,,parks,4800000,427000,,,no,Fail,0.238375515,0.761624485,Winnebago County,,yes,0,6470,2025,6272,,,8495,0,427000,,,IL
17,IL,17,Lake County Forest Preserve District,County,4/13/1999,"Lake County Forest Preserve District, Bond issue for forests, wildlife habitats, trails, greenways, wetlands, prairies, flood control, recreation, education, historic facilities",Bond,,"Forests, recreation, watershed protection, forests, trails, greenways, wildlife habitat",55000000,55000000,55000000,55000000,yes,Pass,0.658026193,0.341973807,,,yes,5,26425,50847,6273,17097,17097,77272,55000000,55000000,,,IL
17,IL,17,Kane County Forest Preserve District,County,4/13/1999,"Kane County Forest Preserve District, Bond for forests, wetlands, natural lands, wildlife habitat, water quality, flood control protection, trails, recreation, educational programs",Bond,,"Forests, open space, parks, recreation, watershed protection, trails, wildlife habitat",70000000,70000000,70000000,70000000,yes,Pass,0.657188456,0.342811544,,TPL,yes,5,12888,24707,6274,17089,17089,37595,70000000,70000000,,,IL
17,IL,17,Homer Township,Municipal,4/13/1999,"Referendum, Bond for acquiring, maintaining open space",Bond,,Open space,8000000,8000000,8000000,8000000,yes,Pass,0.653905054,0.346094946,Will County,,yes,10,1356,2562,6275,1719735827,,3918,8000000,8000000,,,IL
17,IL,17,Glen Ellyn Park District,Municipal,4/13/1999,Bond issue to purchase a specific property,Bond,,Open space,3500000,3500000,3500000,3500000,yes,Pass,,,DuPage County 56/44,,yes,7,,,6276,1729756,,,3500000,3500000,,,IL
17,IL,17,Godfrey Village,Municipal,4/3/2001,$3.7 million bond for open space fund and land conservation,Bond,,Open space,3700000,3700000,,,no,Fail,0.183089214,0.816910786,Madison County,,yes,7,4908,1100,6277,1730094,,6008,0,3700000,,,IL
17,IL,17,Will County Forest Preserve District,County,4/13/1999,"Forest Preserve District of Will County Referendum, Bond for forests, wetlands, prairies, natural lands, wildlife habitats, flood control, education, trails, recreation",Bond,,"Forests, open space, recreation, watershed protection, trails, wildlife habitat",70000000,70000000,70000000,70000000,yes,Pass,0.570430243,0.429569757,,TPL,yes,5,25510,33875,6278,17197,17197,59385,70000000,70000000,,,IL
17,IL,17,Glen Ellyn Park District,Municipal,11/3/1998,$0.20 per $100 of assessed property value property tax increase for parks,Property tax,,Parks,53026260,53026260,,,no,Fail,0.386646357,0.613353643,DuPage County,,yes,7,7248,4569,7000,1729756,,11817,0,53026260,,,IL
17,IL,17,Homer Township,Municipal,11/3/1998,Bond for land acquisition,Bond,,Open space,8000000,8000000,8000000,8000000,yes,Pass,0.59897298,0.40102702,Will County,,yes,10,3280,4899,7057,1719735827,,8179,8000000,8000000,,,IL
17,IL,17,Downers Grove Park District,Municipal,3/19/1996,"Bond for Specified Land Parcel, Parks",Bond,,"parks, open space",3000000,3000000,3000000,3000000,yes,Pass,0.500446296,0.499553704,"DuPage County, Downers Grove Township",,yes,10,6716,6728,7102,1704320604,,13444,3000000,3000000,,,IL
17,IL,17,Plainfield Township Park District,Special District,11/5/1996,"Plainfield Township Park District Referendum, Bond for Community Center, Parks, Recreation, Land Acquisition",Bond,,"Recreation, parks",6500000,2000000,,,no,Fail,0.472405063,0.527594937,Will County,,yes,0,5210,4665,7103,,,9875,0,2000000,,,IL
17,IL,17,Ward's Creek Park District,Special District,11/4/1997,Bonds for New Park,Bond,,parks,450000,450000,450000,450000,yes,Pass,0.726190476,0.273809524,DuPage County,,yes,0,46,122,7151,,,168,450000,450000,,,IL
17,IL,17,Waukegan Park District,Special District,11/4/1997,.25% Property Tax Increase for Park District Projects,Property tax,,"Recreation, parks",39273320,9500000,39273320,9500000,yes,Pass,0.582210869,0.417789131,Lake County,,yes,0,1799,2507,7154,,,4306,9500000,9500000,,,IL
17,IL,17,Homewood-Flossmoor Park District,Special District,3/17/1998,$0.25 per $100 property tax for parks,Property tax,,"Open space, parks",18000000,11000000,18000000,11000000,yes,Pass,0.630722413,0.369277587,Cook County,,yes,0,2791,4767,7194,,,7558,11000000,11000000,,,IL
17,IL,17,Clarendon Hills Park District,Special District,11/3/1998,Bond for parks,Bond,,Parks,4900000,4900000,,,no,Fail,0.444931164,0.555068836,DuPage County,,yes,0,1774,1422,7313,,,3196,0,4900000,,,IL
17,IL,17,Addison,Municipal,11/2/2004,Bond to acquire a golf course and maintain the property as open space,Bond,,"Open space, recreation",10000000,10000000,,,no,Fail,0.307260762,0.692739238,"Advisory Public Question, DuPage County",,yes,10,6421,2848,7314,1704300250,,9269,0,10000000,,,IL
17,IL,17,Grayslake Community Park District,Special District,3/16/2004,General obligation park bonds for land acquisition,Bond,,"Open space, parks, recreation",4000000,4000000,4000000,4000000,yes,Pass,0.62100297,0.37899703,Lake County,,yes,0,2169,3554,7318,,,5723,4000000,4000000,,,IL
17,IL,17,Nunda,Municipal,11/2/2004,"Bond to fund open space plan to acquire, maintain, develop, rehabilitate, and renovate open space lands",Bond,,Open space,20000000,20000000,,,no,Fail,0.464199107,0.535800893,McHenry County,,yes,10,8396,7274,7404,1711154495,,15670,0,20000000,,,IL
17,IL,17,Lyons Township,Municipal,11/2/2004,Bond for the purpose of procuring and improving one or more small parks,Bond,,Open space,10000000,10000000,10000000,10000000,yes,Pass,0.5208,0.4792,Cook County,TPL,yes,10,19767,21483,7446,1703145447,,41250,10000000,10000000,,,IL
17,IL,17,Bartlett Park District,Special District,11/5/1996,"Ordinance 96-8, .11% property tax increase for parks and recreation",Property tax,,"Recreation, open space, parks",,750000,,750000,yes,Pass,0.602711864,0.397288136,DuPage and Kane Counties,,yes,0,4102,6223,7490,,,10325,750000,750000,,,IL
17,IL,17,Dundee Township,Municipal,11/5/1996,"Question 1, Open space plan, 2.5% property tax increase for open space",Property tax,,Open space,18600000,18600000,18600000,18600000,yes,Pass,0.54578142,0.45421858,Kane County,,yes,10,5432,6527,7499,1708921046,,11959,18600000,18600000,,,IL
17,IL,17,Algonquin Township,Municipal,11/4/1997,"Advisory, Non-binding question to acquire open space",Other,Advisory measure,Open space,,,,,yes,Pass,0.800789177,0.199210823,McHenry County,,yes,10,1767,7103,7512,1711100698,,8870,0,0,,,IL
17,IL,17,Kane County Forest Preserve District,County,4/5/2005,Bond to purchase additional open space,Bond,,Open space,75000000,75000000,75000000,75000000,yes,Pass,0.64712324,0.35287676,,,yes,5,16112,29547,7529,17089,17089,45659,75000000,75000000,,,IL
17,IL,17,Will County Forest Preserve District,County,4/5/2005,Bonds to pay for new land acquisitions,Bond,,"Open space, trails, parks",95000000,95000000,95000000,95000000,yes,Pass,0.530432361,0.469567639,,,yes,5,38783,43810,7530,17197,17197,82593,95000000,95000000,,,IL
17,IL,17,Campton Township,Municipal,4/5/2005,Bond for further open space acquisition and preservation,Bond,,Open space,28385000,28385000,28385000,28385000,yes,Pass,0.742734636,0.257265364,Kane County,,yes,10,1080,3118,7536,1708910903,,4198,28385000,28385000,,,IL
17,IL,17,Lyons Township,Municipal,4/5/2005,Bond for the purpose of procuring and improving one or more small parks,Bond,,"Parks, open space",10000000,10000000,,,no,Fail,0.253079775,0.746920225,Cook County,,yes,10,12490,4232,7537,1703145447,,16722,0,10000000,,,IL
17,IL,17,Plato Township,Municipal,4/5/2005,Request to increase the property tax levy by 35.4% for the care of parks and to buy open space,Property tax,,"Parks, open space",28000000,28000000,,,no,Fail,0.28654485,0.71345515,Kane County,,yes,10,859,345,7568,1708960365,,1204,0,28000000,,,IL
17,IL,17,DuPage County Forest Preserve District,County,11/4/1997,"Bonds for preserving wildife habitat, creating trails and greenways, protecting wetlands, and forests, and flood control",Bond,,"Open space, wildlife habitat, forests, trails, greenways",75000000,75000000,75000000,75000000,yes,Pass,0.57403657,0.42596343,,TPL,yes,5,29446,39682,7589,17043,17043,69128,75000000,75000000,,,IL
17,IL,17,Grayslake Community Park District,Special District,4/3/2001,Bond for the purchase of open space and to develop recreation center,Bond,,"Open space, parks, recreation",9000000,2000000,,,no,Fail,0.398701589,0.601298411,,,yes,0,2686,1781,7593,,,4467,0,2000000,,,IL
17,IL,17,Geneva ,Municipal,4/1/1997,Bond for park acquisition,Bond,,"Watershed Protection, parks",10000000,10000000,10000000,10000000,yes,Pass,0.82532418,0.17467582,,,yes,7,687,3246,7602,1728872,,3933,10000000,10000000,,,IL
17,IL,17,Frankfort Park District,Special District,4/4/1995,Bond issue for park acquisition and improvement ,Bond,,Parks,2500000,2500000,2500000,2500000,yes,Pass,0.585253456,0.414746544,Will and Cook Counties,,yes,0,540,762,7650,,,1302,2500000,2500000,,,IL
17,IL,17,Lake County Forest Preserve District,County,11/2/1993,"Bonds to preserve wildlife habitats, trail and greenway corridors, wet lands, prairies and forests",Bond,,"Recreation, wildlife habitat, trails, greenways, forests",30000000,20000000,30000000,20000000,yes,Pass,0.607806763,0.392193237,,,yes,5,20507,31781,7727,17097,17097,52288,20000000,20000000,,,IL
17,IL,17,Lake Zurich,Municipal,11/3/1992,Bond to buy and renovate  Breezewald Park and preserve as open space,Bond,,"Open space, park",1000000,1000000,1000000,1000000,yes,Pass,0.68575028,0.31424972,Lake County,,yes,7,2245,4899,7730,1741742,,7144,1000000,1000000,,,IL
17,IL,17,Lake Forest,Municipal,3/15/1994,Bond to acquire and develop land for public parks,Bond,,"Open space, parks",5200000,5200000,,,no,Fail,0.406038201,0.593961799,Lake County,,yes,7,2892,1977,7744,1741105,,4869,0,5200000,,,IL
17,IL,17,DuPage County Forest Preserve District,County,11/5/1991,Bond to continue forest acquisitions,Bond,,"Open space, forests",5000000,5000000,5000000,5000000,yes,Pass,0.552082078,0.447917922,,,yes,5,29731,36645,7747,17043,17043,66376,5000000,5000000,,,IL
17,IL,17,Lake County Forest Preserve District,County,11/5/1991,Bond for open space land acquisition program,Bond,,Open space,45000000,35000000,,,no,Fail,0.455928311,0.544071689,,,yes,5,28900,24218,7748,17097,17097,53118,0,35000000,,,IL
17,IL,17,Libertyville,Municipal,11/5/1985,Bond to fund the open space district,Bond,,Open space,22600000,22600000,22600000,22600000,yes,Pass,0.55335131,0.44664869,,,yes,10,2319,2873,7753,1709743263,,5192,22600000,22600000,,,IL
17,IL,17,DuPage County Forest Preserve District,County,3/17/1992,Bond to purchase 90 acres of land known as Mayslake,Bond,,Open space,15000000,15000000,,,no,Fail,0.484264856,0.515735144,,,yes,5,84136,79002,7759,17043,17043,163138,0,15000000,,,IL
17,IL,17,DuPage County Forest Preserve District,County,11/3/1992,Bond to purchase 90 acres of land known as Mayslake,Bond,,Open space,17500000,17500000,17500000,17500000,yes,Pass,0.506625258,0.493374742,,,yes,5,160927,165249,7760,17043,17043,326176,17500000,17500000,,,IL
17,IL,17,Dundee Township Park District,Special District,11/3/1992,Bond issue for acquisition and preservation of 50 acres of forested land,Bond,,"Open space, forests",1500000,1500000,1500000,1500000,yes,Pass,0.713034795,0.286965205,,,yes,0,3736,9283,7762,,,13019,1500000,1500000,,,IL
17,IL,17,Romeoville,Municipal,4/5/2005,Real estate transfer tax increase to continue preserving open space and parks,Real estate transfer tax,,"Open space, parks",10000000,10000000,10000000,10000000,yes,Pass,0.50388144,0.49611856,Will County,,yes,7,1406,1428,7796,1765442,,2834,10000000,10000000,,,IL
17,IL,17,Stookey,Municipal,6/1/2004,Bond for parks,Bond,,Parks,5000000,5000000,5000000,5000000,yes,Pass,0.537383178,0.462616822,,,yes,10,891,1035,7818,1716372988,,1926,5000000,5000000,,,IL
17,IL,17,Carol Stream Park District,Special District,11/3/1992,Bond issue for land acquisition,Bond,,Open space,5500000,5500000,,,no,Fail,0.466367713,0.533632287,,,yes,0,6664,5824,7838,,,12488,0,5500000,,,IL
17,IL,17,Orland Park,Municipal,11/8/1988,40-acre community park bond,Bond,,Park,8000000,8000000,8000000,8000000,yes,Pass,0.594285714,0.405714286,,,yes,7,4757,6968,7912,1756640,,11725,8000000,8000000,,,IL
17,IL,17,DeKalb County Forest Preserve District,County,3/21/2006,"10-year, 6-cent property tax increase for the purchase of open space land for preservation",Property tax,,"Open space, watershed potection, wildlife, forestland, trails, recreation",5000000,5000000,5000000,5000000,yes,Pass,0.522199627,0.477800373,,,yes,5,5639,6163,9289,17037,17037,11802,5000000,5000000,2016,,IL
17,IL,17,Glen Ellyn Park District,Municipal,3/21/2006,Bond to purchase land for parks and to develop and maintain existing parks,Bond,,"Open space, parks",12500000,4500000,,,no,Fail,0.40151273,0.59848727,DuPage County,,yes,7,5618,3769,9297,1729756,,9387,0,4500000,,,IL
17,IL,17,Mokena Community Park District,Special District,11/5/1996,Bond for land acquisition and parks,Bond,,"Parks, open space",4500000,4500000,4500000,4500000,yes,Pass,0.503963221,0.496036779,,,yes,0,3129,3179,9386,,,6308,4500000,4500000,,,IL
17,IL,17,Mokena Community Park District,Special District,3/19/1996,Bond for land acquisition and park improvement,Bond,,Open space and parks,13500000,13500000,,,no,Fail,0.258517738,0.741482262,,,yes,0,2111,736,9387,,,2847,0,13500000,,,IL
17,IL,17,Cuba,Municipal,11/7/1989,Bonds to finance open space purchases under the Township Open Space Act and property tax not in excess of 5.75% on the valuation fo taxable property,Bond,,Open space,21430320,21430320,,,no,Fail,0.278821244,0.721178756,,,yes,10,2227,861,9415,1709718004,,3088,0,21430320,,,IL
17,IL,17,Park Ridge Recreation and Park District,Municipal,11/5/1996,Bond for open space land purchase in Edison Park,Bond,,Open space,7845000,7845000,,,no,Fail,0.452418369,0.547581631,Cook County,,yes,7,9408,7773,9433,1757875,,17181,0,7845000,,,IL
17,IL,17,DuPage County Forest Preserve District,County,11/7/2006,Bond for the preservation of open space,Bond,,Open space,68000000,68000000,68000000,68000000,yes,Pass,0.652471011,0.347528989,,TPL,yes,5,88443,166048,9446,17043,17043,254491,68000000,68000000,,,IL
17,IL,17,Glen Ellyn Park District,Municipal,11/7/2006,Bond for capital projects including the preservation of open space,Bond,,"Open space, parks, recreation",11900000,2500000,11900000,2500000,yes,Pass,0.53944217,0.46055783,DuPage County,,yes,7,5961,6982,9510,1729756,,12943,2500000,2500000,,,IL
17,IL,17,Nunda Township,Municipal,4/17/2007,Bond for the acquisition and preservation of open space,Bond,,Open space,20000000,20000000,,,no,Fail,0.496872828,0.503127172,McHenry County,,yes,10,2172,2145,9534,1711154495,,4317,0,20000000,,,IL
17,IL,17,Kane County Forest Preserve District,County,4/17/2007,Bond for the acquisition and preservation of open space,Bond,,"Open space, forest, wildlife habitat",85000000,85000000,85000000,85000000,yes,Pass,0.637142358,0.362857642,,,yes,5,18681,32802,9537,17089,17089,51483,85000000,85000000,,,IL
17,IL,17,McHenry County Conservation District,County,4/17/2007,"Bond for the preservation of open space, wildlife habitat, recreational areas and water quality",Bond,,"Open space, recreation, wildlife habitat, watershed protection",73000000,73000000,73000000,73000000,yes,Pass,0.567100967,0.432899033,,"TPL, TCC",yes,5,13390,17541,9539,17111,17111,30931,73000000,73000000,,,IL
17,IL,17,Kendall County Forest Preserve District,County,4/17/2007,"Bond for the preservation of open space, habitat, recreational areas, trails, and watersheds",Bond,,"Open space, recreation, watershed protection, wildlife, trails, forest",45000000,45000000,45000000,45000000,yes,Pass,0.681150227,0.318849773,,,yes,5,3016,6443,9542,17093,17093,9459,45000000,45000000,,,IL
17,IL,17,Village of Lake Barrington,Municipal,4/17/2007,"Bonds for the purchase of open space, parks and recreational lands",Bond,,"Opn space, recreation, parks",,,,,yes,Pass,0.616504854,0.383495146,"Lake County, Advisory Question",,no,7,474,762,9545,1740884,,1236,0,0,,,IL
17,IL,17,Roselle Park District,Special District,4/17/2007,Bond for the purchase of open space,Bond,,"Open space, parks",1950000,1950000,,,no,Fail,0.465058751,0.534941249,DuPage County,,yes,0,865,752,9557,,,1617,0,1950000,,,IL
17,IL,17,Fox Valley Park District,Special District,2/5/2008,Bond for open space acquisition and park improvements,Bond,,"Open space, recreation, parks, trails",44850000,22500000,44850000,22500000,yes,Pass,0.654075999,0.345924001,"Kane, DuPage, Kendall and Will Counties, Illinois",,yes,0,10651,20139,9658,,,30790,22500000,22500000,,,IL
17,IL,17,St. Charles Park District,Special District,2/5/2008,Bond for capital improvements including some open space acquisition,Bond,,Open space,25000000,2000000,25000000,2000000,yes,Pass,0.587334437,0.412665563,Kane and DuPage Counties,,yes,0,4985,7095,9666,,,12080,2000000,2000000,,,IL
17,IL,17,Lockport Township Park District,Municipal,2/5/2008,Bond for the acquisition of parkland and other capital improvements,Bond,,"Open space, parks, recreation",29900000,1000000,,,no,Fail,0.351300364,0.648699636,Will County,,yes,10,9628,5214,9669,1719744238,,14842,0,1000000,,,IL
17,IL,17,Lake County Forest Preserve District,County,11/4/2008,Bond for the purchase of open space and natural areas,Bond,,"Open space, trails, forest, greenways",185000000,185000000,185000000,185000000,yes,Pass,0.660354085,0.339645915,,,yes,5,94445,183624,9705,17097,17097,278069,185000000,185000000,,,IL
17,IL,17,Waterloo Park District,Special District,11/4/2008,Bond for the purchase of 10.82 acres of new park land,Bond,,"Parks, recreation",385000,385000,,,no,Fail,0.46938385,0.53061615,Monroe County,,yes,0,2773,2453,9773,,,5226,0,385000,,,IL
17,IL,17,Nunda Township,Municipal,4/7/2009,Bond for the preservation of open space,Bond,,Open space,15000000,15000000,,,no,Fail,0.408774874,0.591225126,McHenry County,,yes,10,2466,1705,9790,1711154495,,4171,0,15000000,,,IL
17,IL,17,Grayslake Community Park District,Special District,4/7/2009,8.9 cents per $100 property tax increase for the purchase of open space,Property tax,,"Open space, parks, recreation",6000000,4400000,,,no,Fail,0.467070601,0.532929399,Lake County,,yes,0,2023,1773,9791,,,3796,0,4400000,,,IL
17,IL,17,Washington Township,Municipal,4/7/2009,Bond to acquire and preserve open space,Bond,,Open space,2500000,2500000,,,no,Fail,0.302426343,0.697573657,"Will County, Question is dependent on question 1 authorizing bonds for open space in the Township.  Question 1 failed 32% 68%",,yes,10,805,349,9792,1719779059,,1154,0,2500000,,,IL
17,IL,17,Kane County Forest Preserve District,County,4/5/2011,Bond for the acquisition and preservation of open space,Bond,,"Open space, watershed protection, parks, recreation, habitat",30000000,30000000,30000000,30000000,yes,Pass,0.544973545,0.455026455,,,yes,5,12384,14832,9898,17089,17089,27216,30000000,30000000,,,IL
17,IL,17,Butterfield Park District,Special District,11/4/2014,Bond to acquire and develop parkland,Bond,,"Parks, recreation, open space, trails",2985000,1500000,2985000,1500000,yes,Pass,0.698515417,0.301484583,DuPage County,,yes,0,792,1835,10094,,,2627,1500000,1500000,,,IL
17,IL,17,St. Charles Park District,Special District,4/7/2015,Bond for parks and recreation,Bond,,"Parks, recreation, trails, open space",28000000,2525856,,,no,Fail,0.2435094,0.7564906,Kane and DuPage Counties,,yes,0,4225,1360,10100,,,5585,0,2525856,,,IL
20,KS,20,Johnson County,County,11/3/1998,Bond for land acquistion,Bond,,"Open space, watershed protection",6000000,5700000,6000000,5700000,yes,Pass,0.691505239,0.308494761,,,yes,5,39479,88494,6936,20091,20091,127973,5700000,5700000,,,KS
20,KS,20,Lenexa,Municipal,8/3/2004,"5-year renewal, 1/8 cent sales tax for ""Rain to Recreation"" program",Sales tax,,Watershed protection,7900000,7900000,7900000,7900000,yes,Pass,0.77937052,0.22062948, Johnson County,,yes,10,2124,7503,7281,2009139350,,9627,7900000,7900000,2009,,KS
21,KY,21,Boone County,County,11/4/2008,"2.2 cents per $100 property tax increase for parks, recreation, and natural areas",Property tax,,"Parks, recreation, open space, watershed protections, forest",,,,,no,Fail,0.328877523,0.671122477,,"TPL, TCC",yes,5,31228,15303,9738,21015,21015,46531,0,0,,,KY
22,LA,22,St. Tammany Parish,County,1/17/2004,"20-year, 2 mill property tax increase for open space, flood control, drinking water, wildlife, parks, recreation, traffic control",Property tax,,"Recreation, open space, watershed protection, wildlife habitat, parks",22000000,22000000,,,no,Fail,0.330926594,0.669073406,,"TPL, TCC",yes,5,8340,4125,7020,22103,22103,12465,0,22000000,,,LA
22,LA,22,East Baton Rouge Parish,County,4/27/2004,"10-year, 4.1 mill property tax to acquire, develop, and operate land for public parks and recreational properties",Property tax,,"Parks, recreation",135000000,45000000,135000000,45000000,yes,Pass,0.743209286,0.256790714,East Baton Rouge County,,yes,5,4292,12422,7429,22033,22033,16714,45000000,45000000,2014,,LA
22,LA,22,St. Helena Parish Recreation and Parks District,Special District,10/18/1997,"10-year, 5-mill property tax for parks",Property tax,,Parks,,,,,no,Fail,0.419642857,0.580357143,,,yes,0,1820,1316,7516,,,3136,0,0,,,LA
22,LA,22,Louisiana,State,10/7/1989,Constitutional Amendment to create the Wetlands Conservation and Restoration Fund,Other,"Mineral revenues, oil and gas severance tax","Watershed protection, wildlife, forest",,,,,yes,Pass,0.710548149,0.289451851,No money for acquisition,,no,2,179327,440213,9441,22,22,619540,0,0,,,LA
25,MA,25,Rowley,Municipal,5/9/2000,Bond for the purchase of 104-acre Hunsley Hills for conservation purposes,Bond,,Open space,1200000,1200000,1200000,1200000,yes,Pass,0.756223176,0.243776824,Town Meeting 66/34 May 1,TPL,yes,10,284,881,6282,2500958405,,1165,1200000,1200000,,,MA
25,MA,25,Southampton,Municipal,5/7/2001,"Community Preservation Act,  3% property tax surcharge ",Property tax,,open space,2323278,774426,2323278,774426,yes,Pass,0.586956522,0.413043478,,,yes,10,266,378,6283,2501562745,,644,774426,774426,,,MA
25,MA,25,Shirley,Municipal,5/15/2001,"Community Preservation Act,  3% property tax surcharge ",Property tax,,Open space,2273100,757700,,,no,Fail,0.294915254,0.705084746,,,yes,10,624,261,6284,2501761590,,885,0,757700,,,MA
25,MA,25,Sharon,Municipal,5/1/2001,"Community Preservation Act, 1% property tax surcharge",Property tax,,Open space,5655580,1885193,,,no,Fail,0.489323308,0.510676692,Initiative petition,,yes,10,1698,1627,6285,2502160785,,3325,0,1885193,,,MA
25,MA,25,Saugus,Municipal,11/6/2001,"Community Preservation Act, 1% property tax surcharge",Property tax,,open space,6253349,2084449,,,no,Fail,0.445032512,0.554967488,,TPL,yes,10,3670,2943,6286,2500960015,,6613,0,2084449,,,MA
25,MA,25,Southborough,Municipal,5/14/2001,"Community Preservation Act,  3% property tax surcharge ",Property tax,,Open space,11571720,3857240,,,no,Fail,0.492966752,0.507033248,,,yes,10,793,771,6287,2502763165,,1564,0,3857240,,,MA
25,MA,25,Sterling,Municipal,5/21/2001,"Community Preservation Act,  3% property tax surcharge ",Property tax,,Open space,4026440,1342147,,,no,Fail,0.345053635,0.654946365,Initiative petition,,yes,10,1099,579,6288,2502767385,,1678,0,1342147,,,MA
25,MA,25,Stow,Municipal,5/15/2001,"Community Preservation Act,  3% property tax surcharge ",Property tax,,open space,4892554,1614185,4842554,1614185,yes,Pass,0.63751763,0.36248237,Initiative petition,,yes,10,514,904,6289,2501768050,,1418,1614185,1614185,,,MA
25,MA,25,Aquinnah,Municipal,5/9/2001,"Community Preservation Act,  3% property tax surcharge ",Property tax,,open space,686688,228986,686688,228986,yes,Pass,0.614906832,0.385093168,,,yes,10,62,99,6290,2500701585,,161,228986,228986,,,MA
25,MA,25,Rowley,Municipal,5/8/2001,"Community Preservation Act,  3% property tax surcharge ",Property tax,,Open space,3571539,1190513,3571539,1190513,yes,Pass,0.573127229,0.426872771,Initiative petition,,yes,10,359,482,6291,2500958405,,841,1190513,1190513,,,MA
25,MA,25,Rockport,Municipal,4/3/2001,"Community Preservation Act,  3% property tax surcharge ",Property tax,,Open space,5000000,1666666,,,no,Fail,0.4775,0.5225,Initiative petition,,yes,10,418,382,6292,2500957880,,800,0,1666666,,,MA
