FIPS,State,State FIPS Code,JurisdictionName,JurisdictionType,Date,Description,FinanceMechanism,"""Other"" Comment",Purpose,TotalFundsatStake,Conservation Funds at Stake,Total Funds Approved,Conservation Funds Approved,Pass?,Status,% Yes,% No,Notes,TPL/TCC Support,Voted Acq. Measure,# Digits FIPS,# Votes No,# Votes Yes,Record ID#,Related Code - FIPS DB,Related Code - Political DB,Total Votes,TPL Mission Funds Approved,TPL Mission Funds at Stake,Year of Expiration,Year of Renewal,State Abbreviation
2,AK,2,Matanuska-Susitna Borough,County,10/7/2003,"Bond for park and recreation facility acquisition, improvement",Bond,,"Parks, recreation",5375000,490000,,,no,Fail,0.492633735,0.507366265,,,yes,5,6440,6253,6053,2170,,12693,0,490000,,,AK
2,AK,2,Anchorage,Municipal,4/2/2002,Proposition E; Bond measure for recreation areas,Bond,,Recreation,1600000,1600000,,,no,Fail,0.404291135,0.595708865,,,yes,7,20879,14170,6054,203000,,35049,0,1600000,,,AK
2,AK,2,Anchorage,Municipal,4/1/2003,"Prop 7: Anchorage Parks and Recreation Service Area Capital Improvement Bonds, Bond for park improvements, recreation, land acquisition",Bond,,"Recreation, parks",5000000,325000,,,no,Fail,0.48454196,0.51545804,,,yes,7,31645,29747,6055,203000,,61392,0,325000,,,AK
2,AK,2,Anchorage,Municipal,4/16/1996,"Ordinance 96-24S, Bond for Parks, Recreation, Trails",Bond,,"Parks, recreation, trails",11950000,11950000,,,no,Fail,0.401317552,0.598682448,,,yes,7,26809,17971,7082,203000,,44780,0,11950000,,,AK
2,AK,2,Anchorage,Municipal,4/6/2004,"Bond for park improvements, trail upgrades, and recreational facilities",Bond,,"Trails, parks, greenways",4335000,4335000,,,no,Fail,0.446061595,0.553938405,,,yes,7,29192,23507,7413,203000,,52699,0,4335000,,,AK
2,AK,2,Anchorage,Municipal,4/4/2006,Bond to protect water quality and to preserve and enhance open space and natural areas,Bond,,"Watershed protection, opens pace, parks, recreation ",3950000,3950000,,,no,Fail,0.487359631,0.512640369,,"TPL, TCC",yes,7,35608,33852,9304,203000,,69460,0,3950000,,,AK
2,AK,2,Anchorage,Municipal,4/18/1995,Bond for parks and capital improvements,Bond,,"Parks, recreation",6110000,954000,6110000,954000,yes,Pass,0.579068453,0.420931547,,,yes,7,20858,28694,9362,203000,,49552,954000,954000,,,AK
1,AL,1,Alabama,State,11/3/1992,"Alabama Forever Land Trust-for the acquisition, maintenance and protection of lands and water areas,  plant and animal life, geological formations, wild habitats, recreational value and scenic beauty",Other,Interest from oil and gas royalties,"Open space, recreation,wildlife habitat,watershed protection",200000000,200000000,200000000,200000000,yes,Pass,0.836485201,0.163514799,,,yes,2,177918,910167,7875,1,1,1088085,200000000,200000000,,,AL
1,AL,1,Alabama,State,11/6/2012,"20-year, continuation of a 10 percent levy on offshore gas operations, which fund the Forever Wild program and the purchase of recreational lands",Other,Royalties from offshore gas operations in Alabama waters,"Wildlife habitat, parks, recreation, open space, watershed protection",300000000,300000000,300000000,300000000,yes,Pass,0.751581006,0.248418994,"Funds are capped at $15M annually, Statewide Amendment 1",TPL,yes,2,437560,1323819,9904,1,1,1761379,300000000,300000000,,,AL
4,AZ,4,Flagstaff,Municipal,5/18/2004,Bond for regional park and neighborhood parks,Bond,,Parks,2800000,2800000,2800000,2800000,yes,Pass,0.584430605,0.415569395, Coconino County,,yes,7,4671,6569,6058,423620,,11240,2800000,2800000,,,AZ
4,AZ,4,Flagstaff,Municipal,5/18/2004,"Bond for wildlife, meadows, greenways",Bond,,"wildlife habitat, greenways",10100000,10100000,,,no,Fail,0.469623915,0.530376085, Coconino County,,yes,7,6050,5357,6059,423620,,11407,0,10100000,,,AZ
4,AZ,4,Flagstaff,Municipal,5/18/2004,Bond for wildlife,Bond,,wildlife habitat,5500000,5500000,5500000,5500000,yes,Pass,0.559456598,0.440543402, Coconino County,,yes,7,4994,6342,6060,423620,,11336,5500000,5500000,,,AZ
4,AZ,4,Prescott,Municipal,5/16/2000,"1-cent sales tax, portion for open space",Sales tax,,Open space,75000000,40000000,75000000,40000000,yes,Pass,0.510319989,0.489680011,,TPL,yes,7,3535,3684,6061,457380,,7219,40000000,40000000,,,AZ
4,AZ,4,Flagstaff,Municipal,5/18/2004,"Bond for neighborhood open space, trails, greenways, wildlife, scenic areas, geologic features",Bond,,"Open space, wildlife habitat, trails, greenways",7600000,7600000,7600000,7600000,yes,Pass,0.590553946,0.409446054, Coconino County,,yes,7,4664,6727,6063,423620,,11391,7600000,7600000,,,AZ
4,AZ,4,Pima County,County,5/20/1997,"Question Number 4: Sonoran Desert Open Space and Historic Preservation, Bond for Sonoran Desert open space, wildlife habitat, trails, cultural and historic sites",Bond,,"Open space, wildlife habitat, trails",36300000,36300000,36300000,36300000,yes,Pass,0.677242582,0.322757418,,TPL,yes,5,20732,43502,6064,4019,4019,64234,36300000,36300000,,,AZ
4,AZ,4,Glendale,Municipal,11/2/1999,"Proposition 10, Bond for open space, trails",Bond,,"Open space, trails",53700000,53700000,53700000,53700000,yes,Pass,0.680758593,0.319241407,,,yes,7,2424,5169,6065,427820,,7593,53700000,53700000,,,AZ
4,AZ,4,Phoenix,Municipal,9/7/1999,"Proposition 101, 10-year, .1 percent cent sales tax increase for open space, regional and neighborhood parks, recreation, public safety",Sales tax,,"Open space, parks, recreation",256000000,256000000,256000000,256000000,yes,Pass,0.796136309,0.203863691,,TPL,yes,7,18689,72985,6066,455000,,91674,256000000,256000000,2009,,AZ
4,AZ,4,Scottsdale,Municipal,9/11/1999,"Question 1, Bond for acquisition of specified parcel",Bond,,Open space,200000000,200000000,200000000,200000000,yes,Pass,0.773252298,0.226747702,,,yes,7,7499,25573,6067,465000,,33072,200000000,200000000,,,AZ
4,AZ,4,Coconino County,County,11/5/2002,"10-year, 1/8¢ sales tax increase to protect wetlands, forests, open space, park and trail improvements",Sales tax,,"Watershed protection, open space, forests, parks, trails",33000000,19800000,33000000,19800000,yes,Pass,0.61701002,0.38298998,,"TPL, TCC",yes,5,11582,18659,6068,4005,4005,30241,19800000,19800000,,,AZ
4,AZ,4,Gilbert,Municipal,11/6/2001,"Question 3; Portion of a bond issue for open space acquisition (total funds for measure, $57,481,000)",Bond,,Open space,20394000,20394000,20394000,20394000,yes,Pass,0.693816226,0.306183774,,,yes,7,1936,4387,6069,427400,,6323,20394000,20394000,,,AZ
4,AZ,4,Scottsdale,Municipal,5/18/2004,"30-year, .15% sales tax increase for acquisition of specified open space parcel",Sales tax,,Open space,430000000,230000000,430000000,230000000,yes,Pass,0.545298874,0.454701126,"Question 2 authorized bonds of $500M for the McDowell Sonoran Preserve.  If question 1 had failed, question 2 would have been nullified","TPL, TCC",yes,7,14339,17196,7014,465000,,31535,230000000,230000000,2034,,AZ
4,AZ,4,Pima County,County,5/18/2004,"Bond for open space, habitat protection, and forests",Bond,,"Open space, wildlife habitat, forests",174300000,174300000,174300000,174300000,yes,Pass,0.661633097,0.338366903,,"TPL, TCC",yes,5,29264,57222,7152,4019,4019,86486,174300000,174300000,,,AZ
4,AZ,4,Pima County,County,5/18/2004,"Bond for the improvement and aquisition of land for parks, trails, and recreation",Bond,,"Parks, trails, recreation",96450000,96450000,96450000,96450000,yes,Pass,0.620949896,0.379050104,,,yes,5,32546,53316,7197,4019,4019,85862,96450000,96450000,,,AZ
4,AZ,4,Mesa,Municipal,3/9/2004,"Bond to provide funds to acquire, construct and improve parks, open space, and lands",Bond,,"Open space, recreation",9750000,9750000,9750000,9750000,yes,Pass,0.511212131,0.488787869,Maricopa County,,yes,7,14408,15069,7412,446000,,29477,9750000,9750000,,,AZ
4,AZ,4,Chandler,Municipal,5/18/2004,"Bond to construct, improve, and acquire parks and open spaces for recreational purposes",Bond,,"Open space, recreation, parks",40600000,17350000,40600000,17350000,yes,Pass,0.751601831,0.248398169,Maricopa County,,yes,7,2171,6569,7414,412000,,8740,17350000,17350000,,,AZ
4,AZ,4,Arizona,State,11/3/1998,"Proposition 303, State appropriations for open space",Other,Appropriation,Open space,220000000,220000000,220000000,220000000,yes,Pass,0.528883197,0.471116803,,,yes,2,446598,501358,7484,4,4,947956,220000000,220000000,,,AZ
4,AZ,4,Peoria,Municipal,5/17/2005,"Bond to acquire, construct, improve and equip one or more parks for use as open space and for recreational purposes",Bond,,"Open space, parks, trails, recreation",35000000,23000000,35000000,23000000,yes,Pass,0.773032007,0.226967993,,,yes,7,2099,7149,7564,454050,,9248,23000000,23000000,,,AZ
4,AZ,4,Arizona,State,11/6/1990,Lottery revenues to parks and open space,Other,Lottery,"Parks, open space, wildlife habitat, trails",400000000,400000000,400000000,400000000,yes,Pass,0.620141627,0.379858373,,,yes,2,396952,648048,7745,4,4,1045000,400000000,400000000,,,AZ
4,AZ,4,Scottsdale,Municipal,5/23/1995,"Proposition 400, 30-year, .2% transaction privilege and use tax acquisition of supplement private efforts to acquire land for the McDowell Sonoran Preserve",Sales tax,,"Open space, wildlife habitat, recreation",272545560,272545560,272545560,272545560,yes,Pass,0.631102312,0.368897688,,,yes,7,96338,164813,7843,465000,,261151,272545560,272545560,2025,,AZ
4,AZ,4,Phoenix,Municipal,4/19/1988,"Proposition 8- Bond for 6,000 acres of open space preservation",Bond,,"Open space, parks",137240000,34810000,137240000,34810000,yes,Pass,0.580337983,0.419662017,,,yes,7,37548,51924,7904,455000,,89472,34810000,34810000,,,AZ
4,AZ,4,Maricopa County,County,11/5/1991,Park and Recreation bonds,Bond,,"Recreation, parks",40855000,8171000,,,no,Fail,0.418596503,0.581403497,,,yes,5,122793,88408,7927,4013,4013,211201,0,8171000,,,AZ
4,AZ,4,Cave Creek,Municipal,9/12/2000,"Bond for the acquisition of Spur Cross Ranch and other lands for open space, parks and recreational uses",Bond,,"Open space, recreation, parks",6825000,6825000,6825000,6825000,yes,Pass,0.777421938,0.222578062,Maricopa County,,yes,7,278,971,7935,411300,,1249,6825000,6825000,,,AZ
4,AZ,4,Phoenix,Municipal,3/14/2006,"Bond for recreational opportunities, open spaces and parks",Bond,,"Open space, parks, recreation",120500000,17060000,120500000,17060000,yes,Pass,0.63146316,0.36853684,Maricopa County,,yes,7,30321,51953,9257,455000,,82274,17060000,17060000,,,AZ
4,AZ,4,Phoenix,Municipal,5/20/2008,"30-year, extension of .1 percent sales tax for open space, parks, and park improvements",Sales tax,,"Parks, recreation, open space",900000000,540000000,900000000,540000000,yes,Pass,0.826866703,0.173133297,"Phoenix Parks and Preserve Initiative, Prop A",TCC,yes,7,19549,93364,9667,455000,,112913,540000000,540000000,2038,,AZ
4,AZ,4,Maricopa,Municipal,11/4/2008,Bond for park acquisition and improvements,Bond,,"Parks, recreation, trails",65500000,13500000,65500000,13500000,yes,Pass,0.612776937,0.387223063,"Question 5, Pinal County",,yes,7,4352,6887,9785,444410,,11239,13500000,13500000,,,AZ
4,AZ,4,Phoenix,Municipal,3/13/2001,Bond for open space and recreational facilities,Bond,,"Open space, recreation",77000000,15000000,77000000,15000000,yes,Pass,0.76703645,0.23296355,Maricopa County,,yes,7,22197,73084,9799,455000,,95281,15000000,15000000,,,AZ
4,AZ,4,Phoenix,Municipal,5/8/1973,Bond for Phoenix Mountain Preserve,Bond,,"Open space, parks",23500000,22500000,23500000,22500000,yes,Pass,,,,,no,7,,,9804,455000,,,22500000,22500000,,,AZ
4,AZ,4,Pima County,County,11/3/2015,"Proposition 430, Bond for natural area conservation and historic preservation",Bond,,"Open space, watershed protection",112050000,98750000,,,no,Fail,0.397526609,0.602473391,Proposition 430,,yes,5,108735,71746,10102,4019,4019,180481,0,98750000,,,AZ
4,AZ,4,Prescott,Municipal,8/25/2015,"20-year, .08 percent sales tax dedicated to the acquisition, maintenance, and improvement of open space",Sales tax,"Also called ""transaction privilege tax""",Open space,20800000,10400000,,,no,Fail,0.423277244,0.576722756,"Yavapai County, Question 4",,yes,7,8637,6339,10104,457380,,14976,0,10400000,2016,,AZ
4,AZ,4,Pima County,County,11/3/2015,"Proposition 426, Bond for economic development including Davis Monthan Air Force Base Land Acquisitions",Bond,,Open space,91375000,5000000,,,no,Fail,0.392831418,0.607168582,Proposition 426,,yes,5,112954,73080,10107,4019,4019,186034,0,5000000,,,AZ
4,AZ,4,Pima County,County,11/3/2015,"Proposition 431, Bond for flood control and drainage",Bond,,Watershed protection,16935000,5000000,,,no,Fail,0.48425778,0.51574222,Proposition 431,,yes,5,93289,87594,10108,4019,4019,180883,0,5000000,,,AZ
4,AZ,4,Pima County,County,11/3/2015,Bond for parks and recreation,Bond,,"Parks, recreation, trails",191500000,0,0,0,no,Fail,0.419257811,0.580742189,Prop 428,TPL,no,5,108122,78057,10130,4019,4019,186179,0,191500000,,,AZ
4,AZ,4,Flagstaff,Municipal,3/5/1996,Bonding authorization for Peaks Scenic Parkway project,Bond,,"Open space, recreation, parks, trails",66157375,33078688,,,no,Fail,0.374828734,0.625171266,"Coconino County, Proposition 402,  Prop 402 (bonds) and 403 (sales tax) needed to pass.  Both failed ",,yes,7,6388,3830,10164,423620,,10218,0,33078688,,,AZ
4,AZ,4,Flagstaff,Municipal,3/5/1996,Excise tax increase to support bonds to pay for Peaks Scenic Parkway open space and transportation project,Sales tax,,"Open space, recreation, parks, trails",,,,,no,Fail,0.356386109,0.643613891,Prop 403.  Needed to pass along with Prop 402.  Funds located in Prop 402,,yes,7,6561,3633,10165,423620,,10194,0,0,,,AZ
4,AZ,4,Flagstaff,Municipal,10/2/1922,Bond for the purchase of 160-acre John Clark ranch for use as park,Bond,,"Parks, recreation, open space",60000,60000,60000,60000,yes,Pass,0.530674847,0.469325153,Coconino County,,yes,7,153,173,10176,423620,,326,60000,60000,,,AZ
4,AZ,4,Peoria,Municipal,11/8/2016,"4/10th of a cent sales tax increase for parks, open space, trails and public safety",Sales tax,,"Open space, recreation, parks",288000000,114962200,,,no,Fail,0.444256029,0.555743971,"Maricopa County, Proposition 400",,yes,7,38672,30914,10193,454050,,69586,0,114962200,,,AZ
5,AR,5,Rogers,Municipal,5/6/2003,"Park and Recreational Improvement Bonds, Bond for acquiring, improving parks and recreational facilities",Bond,,"Parks, recreation",9100000,2000000,9100000,2000000,yes,Pass,0.79227434,0.20772566,,,yes,10,527,2010,6056,513193222,,2537,2000000,2000000,,,AR
5,AR,5,Hot Springs,Municipal,8/26/2003,"7-year, .375% sales tax for open space, park maintenance, improvements",Sales tax,,"Open space, parks",23300000,3300000,,,no,Fail,0.341961461,0.658038539,,,yes,10,2288,1189,6057,505191773,,3477,0,3300000,,,AR
5,AR,5,Arkansas,State,11/5/1996,"Constitutional Amendment. 1/8 of one percent sales tax to fund capital improvements, maintenance projects and land acquisition",Sales tax,,"Open space, parks",950000000,237500000,950000000,237500000,yes,Pass,0.505163636,0.494836364,,,yes,2,396932,405216,7517,5,5,802148,237500000,237500000,,,AR
5,AR,5,Hot Springs,Municipal,11/3/1992,Bonds for acquisition of land adjoining existing parks and construction of parking for persons,Bond,,Parks,1200000,300000,,,no,Fail,0.414686631,0.585313369,Garland County,,yes,10,6528,4625,7857,505191773,,11153,0,300000,,,AR
6,CA,6,San Francisco County,County,3/7/2000,"Proposition A, bond for neighborhood recreation and park facilities",Bond,,"Parks, recreation",110000000,4000000,110000000,4000000,yes,Pass,0.78792969,0.21207031,Minimal amount for acquisition,TPL,yes,5,38885,144474,6071,6075,6075,183359,4000000,4000000,,,CA
6,CA,6,Davis,Municipal,11/7/2000,"Special Open Space Protection Tax for acquisition, improvements, and maintenance of open space",Other,Parcel tax,Open space,17500000,17500000,17500000,17500000,yes,Pass,0.704546343,0.295453657,,TPL,yes,7,7558,18023,6072,618100,,25581,17500000,17500000,,,CA
6,CA,6,Santa Clara County Open Space Authority,County,11/6/2001,"Open Space Preservation Measure; $20 per parcel annual assessment for acquisition, preservation and development of open space, parks, trails, and waterways",Other,Benefit assessment,"Open space, parks, trails, watershed protection",160000000,160000000,,,yes,Pass*,,,"In a unanimous ruling, the California Supreme Court found that the 2001 special assessment by the county's Open Space Authority violated Proposition 218, a 12-year-old voter-approved law known as the ""Right to Vote on Taxes Act."" 

51% 49%","TPL, TCC",yes,5,,,6073,6085,6085,,0,160000000,,,CA
6,CA,6,Granite Bay Assessment District for Park and Recreation,Special District,11/20/2001,"$58 per parcel annual assessment for maintenance, acquisition and development of park land and recreation areas, and walking and bike trails",Other,Benefit assessment,"Open space, greenways, recreation",8388000,8388000,8388000,8388000,yes,Pass,0.633599588,0.366400412,mailed ballot for Granite Bay (an unicorporated area of Placer County),,yes,0,1422,2459,6074,,,3881,8388000,8388000,,,CA
6,CA,6,California,State,3/7/2000,"Proposition 12, Safe Neighborhoods, Clean Water and Coastal Protection Act",Bond,,"Open space, watershed protection, parks",2100000000,1200000000,2100000000,1200000000,yes,Pass,0.631142754,0.368857246,,TPL,yes,2,2722030,4657600,6076,6,6,7379630,1200000000,1200000000,,,CA
6,CA,6,Duarte,Municipal,6/26/2001,Special $48 per parcel tax for open space acquisition and preservation (funds $5 million),Other,parcel tax,Open space,5000000,5000000,,,no,Fail,0.410958904,0.589041096,requires two-thirds,,yes,7,1591,1110,6077,619990,,2701,0,5000000,,,CA
6,CA,6,California,State,3/7/2000,"Proposition 13, Safe Drinking Water, Watershed Protection, and Flood Control Bond",Bond,,"Open space, watershed protection",1970000000,505000000,1970000000,505000000,yes,Pass,0.647355333,0.352644667,,TPL,yes,2,2585298,4745872,6078,6,6,7331170,505000000,505000000,,,CA
6,CA,6,Malibu,Municipal,11/6/2001,"Measure K; $15 million bond for parks, playgrounds, playing fields, trails, and community centers (measure needed 2/3 majority to pass)",Bond,,"Parks, trails",15000000,15000000,,,no,Fail,0.612968184,0.387031816,2/3rds needed to pass,,yes,7,961,1522,6079,645246,,2483,0,15000000,,,CA
6,CA,6,Monrovia,Municipal,7/11/2000,Special parcel tax for purchase and preservation of urban open space,Other,Parcel tax,"Open space, parks",10000000,10000000,10000000,10000000,yes,Pass,0.772909305,0.227090695,,,yes,7,964,3281,6080,648648,,4245,10000000,10000000,,,CA
6,CA,6,Napa County,County,11/7/2000,"1.5% transient occupancy tax (hotel tax)increase for acquisition, protection and enhancement of parks and open space, and for the Napa Valley Conference and Visitors Bureau",Other,transient occupancy tax,Open space,14900000,640700,,,no,Fail,0.63665337,0.36334663,2/3rd vote required,,yes,5,17671,30963,6081,6055,6055,48634,0,640700,,,CA
6,CA,6,Placer County,County,11/7/2000,"Measure W, 20-year, 1/4-cent sales tax increase to protect land around water, save farmland, develop new parks and trails, protect scenic landscapes",Sales tax,,Open space,200000000,150000000,,,no,Fail,0.273613445,0.726386555,,"TPL, TCC",yes,5,79957,30118,6082,6061,6061,110075,0,150000000,,,CA
6,CA,6,San Francisco,Municipal,3/7/2000,"Proposition C, Charter Amendment, 30-year property tax set aside for parks, recreation and open space",Property tax,Charter Amendment,"Parks, recreation, open space",510000000,150000000,510000000,150000000,yes,Pass,0.737605776,0.262394224,,TPL,yes,7,44993,126478,6083,667000,,171471,150000000,150000000,2030,,CA
6,CA,6,Oakland,Municipal,11/5/2002,Measure DD; bond measure for water quality projects and open space,Bond,,"Watershed protection, open space",198250000,50000000,198250000,50000000,yes,Pass,0.800364972,0.199635028,2/3 needed,,yes,7,17613,70613,6084,653000,,88226,50000000,50000000,,,CA
6,CA,6,San Carlos,Municipal,11/2/1999,"Measure G, 10-year, per parcel tax for parks",Other,Parcel tax,Parks,1200000,,1200000,,yes,Pass,0.762450018,0.237549982,,,yes,7,1307,4195,6085,665070,,5502,0,0,2009,,CA
6,CA,6,Santa Monica Mountains Open Space Preservation Assessment District 1,Special District,8/1/2002,Special assessment and bond to acquire and protect open space in the Santa Monica Mountains,Other,Benefit assessment,Open space,25600000,25600000,25600000,25600000,yes,Pass,,,77% to 23%,,yes,0,,,6086,,,,25600000,25600000,,,CA
6,CA,6,Santa Monica Mountains Open Space Preservation Assessment District 2,Special District,8/1/2002,Special assessment and bond to acquire and protect open space in the Santa Monica Mountains,Other,Benefit assessment,Open space,,,,,yes,Pass,,,Funds are counted in District 1 68% to 32%,,yes,0,,,6087,,,,0,0,,,CA
6,CA,6,California,State,3/5/2002,"Proposition 40; bond for clean water, air, parks and coastal protection",Bond,,"Parks, watershed protection",2600000000,2300000000,2600000000,2300000000,yes,Pass,0.568538693,0.431461307,,"TPL, TCC",yes,2,2101516,2769178,6088,6,6,4870694,2300000000,2300000000,,,CA
6,CA,6,California,State,11/5/2002,"Proposition 50; bond to fund a variety of water projects, including coastal land protection",Bond,,Watershed protection,3440000000,1500000000,3440000000,1500000000,yes,Pass,0.553178559,0.446821441,,"TPL, TCC",yes,2,3076333,3808594,6089,6,6,6884927,1500000000,1500000000,,,CA
6,CA,6,California,State,11/5/2002,Proposition 51; 30% of state revenues collected on motor vehicle tax to be allocated for transportation programs and land conservation,Other,Motor vehicle tax,Open space,20000000000,2000000000,,,no,Fail,0.414287824,0.585712176,,"TPL, TCC",yes,2,3922590,2774539,6090,6,6,6697129,0,2000000000,,,CA
6,CA,6,Valley Center Park and Recreation District,Special District,11/5/2002,"Proposition GG; $14 per parcel tax increase to acquire open space, parks and recreation, $330,000/yr",Other,Parcel tax,"open space, parks, recreation",6600000,6600000,,,no,Fail,0.609334033,0.390665967,"Requires 2/3rds approval, San Diego County",,yes,0,1490,2324,6091,,,3814,0,6600000,,,CA
6,CA,6,Santa Cruz,Municipal,11/3/1998,"Measure G, Bond for open space, recreation, parks",Bond,,"Open space, recreation, parks",7000000,2700000,7000000,2700000,yes,Pass,0.761120023,0.238879977,,,yes,7,4914,15657,6092,669112,,20571,2700000,2700000,,,CA
6,CA,6,Los Angeles County,County,11/5/1996,"Proposition A, Safe Neighborhood Parks Act, 20-year assessment for parks, beaches, water quality, open space, and recreation",Other,Benefit Assessment,"Parks, recreation, watershed protection, open space",319000000,150000000,319000000,150000000,yes,Pass,0.650699656,0.349300344,,TPL,yes,5,772783,1439591,6938,6037,6037,2212374,150000000,150000000,2019,,CA
6,CA,6,Marin County,County,11/5/1996,"Measure A, 10-years, 1/4 of 1 Percent Sales Tax Increase for Parks, Open Space, Farmland",Sales tax,,"Open space, farmland, parks",5000000,5000000,,,no,Fail,0.576628814,0.423371186,Needed 2/3 voter approval,,yes,5,45708,62254,7002,6041,6041,107962,0,5000000,,,CA
6,CA,6,Oakland,Municipal,11/5/1996,"Measure I, Bond for Libraries, Museums, Parks, Recreation",Bond,,"Recreation, parks",45420000,7600000,45420000,7600000,yes,Pass,0.77677873,0.22322127,,,yes,7,23113,80430,7003,653000,,103543,7600000,7600000,,,CA
6,CA,6,Albany,Municipal,11/5/1996,"Measure R, establishment of an assessment district for open space",Other,Benefit assessment,"Recreation, open space, watershed protection",9600000,5000000,9600000,5000000,yes,Pass,0.615453999,0.384546001,,TPL,yes,7,2558,4094,7029,600674,,6652,5000000,5000000,,,CA
6,CA,6,California,State,11/5/1996,"Proposition 204, Clean Safe Reliable Water Supply Bond Act",Bond,,"Watershed protection, wildlife habitat",995000000,200000000,995000000,200000000,yes,Pass,0.628385074,0.371614926,,TPL,yes,2,3560084,6019951,7032,6,6,9580035,200000000,200000000,,,CA
6,CA,6,Marin County,County,11/3/1998,"Measure B, 20-year, 0.5-cent sales tax increase for transportation improvements, open space, trails, parks",Sales tax,,"Open space, trails, parks",377127800,55000000,,,no,Fail,0.425076055,0.574923945,,,yes,5,53104,39263,7079,6041,6041,92367,0,55000000,,,CA
6,CA,6,Contra Costa County,County,7/27/2004,Creation of special assessment district to fund open space in Contra Costa County.,Other,Benefit Assessment,"Open space, parks, farmland, watershed protection, trails. recreation, greenways",167320000,18102000,,,no,Fail,0.501174523,0.498825477,Votes are weighted according to the amount of property each landowner will have assessed.,TPL,yes,5,48204,48431,7105,6013,6013,96635,0,18102000,,,CA
6,CA,6,Portola Valley,Municipal,11/4/1997,"Measure B, 4-year, 2% Utility Tax Increase for Open Space",Other,Utility tax,Open space,608539,608539,608539,608539,yes,Pass,0.808921438,0.191078562,,,yes,7,287,1215,7133,658380,,1502,608539,608539,2001,,CA
6,CA,6,Belmont,Municipal,11/4/1997,"Measure E, Advisory Vote on Preserving Land in San Juan Canyon",Other,advisory measure,Open space,,,,,yes,Pass,0.677304965,0.322695035,,,yes,7,1274,2674,7134,605108,,3948,0,0,,,CA
6,CA,6,Ventura County,County,11/2/2004,"Measure A, 10-year, .25% sales tax increase for the creation of an open space district and funding for acquistions",Sales tax,,"Open space, parks, farmland",250000000,250000000,,,no,Fail,0.487380692,0.512619308,Requires 2/3rds vote,"TPL, TCC",yes,5,138297,131488,7223,6111,6111,269785,0,250000000,,,CA
6,CA,6,San Diego County,County,11/2/2004,"Measure A, 40-year extension of a 1/2 cent sales tax for transit improvements, including mitigation projects",Sales tax,,Open space,14000000000,880000000,14000000000,880000000,yes,Pass,0.670114114,0.329885886,2/3rds required,TPL,yes,5,336031,682597,7259,6073,6073,1018628,880000000,880000000,2044,,CA
6,CA,6,Los Angeles,Municipal,11/2/2004,"Proposition O, Clean water bond to reduce total maximum daily load, including storm water retention facilities, parks, and greenbelts.",Bond,,"Open space, parks",500000000,100000000,500000000,100000000,yes,Pass,0.76297876,0.23702124,2/3rds required,"TPL, TCC",yes,7,237505,764536,7262,644000,,1002041,100000000,100000000,,,CA
