37,NC,37,Cary,Municipal,4/8/1994,Bonds for parks and recreation,Bond,,"Open space, parks, recreation, greenways",9425000,1885000,9425000,1885000,yes,Pass,0.536140224,0.463859776,Wake County,,yes,7,2567,2967,7830,3710740,,5534,1885000,1885000,,,NC
37,NC,37,Mecklenburg County,County,11/5/1991,Bonds for parks,Bond,,"Recreation, parks, greenways",10245000,5000000,10245000,5000000,yes,Pass,0.607040388,0.392959612,,,yes,5,28488,44008,7859,37119,37119,72496,5000000,5000000,,,NC
37,NC,37,Mecklenburg County,County,11/8/2005,Bond for the purchase of land to protect the Mountain Island Lake watershed and for a community college and public school purposes,Bond,,"Watershed protection, parks",66000000,20000000,,,no,Fail,0.466763366,0.533236634,,TPL,yes,5,49262,43121,7861,37119,37119,92383,0,20000000,,,NC
37,NC,37,Newton,Municipal,11/6/1990,Bond for acquiring and constructing new park and recreational facilities,Bond,,"Recreation, parks",350000,,350000,,yes,Pass,0.586909091,0.413090909,Catawba County,,yes,7,1136,1614,7870,3747000,,2750,0,0,,,NC
37,NC,37,Onslow County,County,11/6/1990,Bond for parks,Bond,,Parks,,,,,no,Fail,0.361444974,0.638555026,,,yes,5,9510,5383,7871,37133,37133,14893,0,0,,,NC
37,NC,37,Forsyth County,County,11/7/1989,"Bond for for the purpose of providing funds, with any other available funds, for enlarging and improving Tanglewood Park",Bond,,Parks,3200000,500000,,,no,Fail,0.498333378,0.501666622,,,yes,5,18512,18389,7872,37067,37067,36901,0,500000,,,NC
37,NC,37,Forsyth County,County,11/7/1989,Bond for parks and recreation,Bond,,"Recreation, parks",1500000,750000,1500000,750000,yes,Pass,0.535880559,0.464119441,,,yes,5,17346,20028,7873,37067,37067,37374,750000,750000,,,NC
37,NC,37,Guilford County,County,11/8/1988,bond for acquisition and development of regional parks,Bond,,"Open space, parks, greenways",12000000,12000000,12000000,12000000,yes,Pass,0.705347366,0.294652634,,,yes,5,29061,69567,7880,37081,37081,98628,12000000,12000000,,,NC
37,NC,37,Mecklenburg County,County,11/7/1989,Bonds for parks,Bond,,"Parks, greenways",15820000,6000000,15820000,6000000,yes,Pass,0.629266038,0.370733962,,,yes,5,27266,46280,7882,37119,37119,73546,6000000,6000000,,,NC
37,NC,37,Kernersville,Municipal,5/8/1990,Bond for parks,Bond,,Parks,2000000,800000,,,no,Fail,0.278656126,0.721343874,Forsyth County,,yes,7,730,282,7884,3735600,,1012,0,800000,,,NC
37,NC,37,Union County,County,11/8/1994,"Bond for the acquisition of land, installation of furnishings and equipment",Bond,,"Parks, open space",2000000,,,,no,Fail,0.417896068,0.582103932,,,yes,5,9667,6940,7889,37179,37179,16607,0,0,,,NC
37,NC,37,Charlotte,Municipal,11/8/1988,Bond for parks and recreation,Bond,,"Recreation, parks",9500000,2000000,9500000,2000000,yes,Pass,0.644160584,0.355839416,,,yes,7,40560,73424,7899,3712000,,113984,2000000,2000000,,,NC
37,NC,37,North Carolina,State,11/2/1993,State Park Bonds,Bond,,Parks,35000000,20000000,35000000,20000000,yes,Pass,0.56757041,0.43242959,,,yes,2,353602,464108,7922,37,37,817710,20000000,20000000,,,NC
37,NC,37,New Hanover County,County,5/2/2006,Bond for parks and recreation improvements including the purchase of recreational lands,Bond,,"Parks, recreation",35500000,10700000,35500000,10700000,yes,Pass,0.670578802,0.329421198,,"TPL, TCC",yes,5,4519,9199,9296,37129,37129,13718,10700000,10700000,,,NC
37,NC,37,Greensboro,Municipal,11/7/2006,Bond for the aquisition of new parkland and improvements to existing parks,Bond,,Parks,5000000,2400014,5000000,2400014,yes,Pass,0.616383067,0.383616933,"Proposal 7, Guilford County",,yes,7,20245,32529,9478,3728000,,52774,2400014,2400014,,,NC
37,NC,37,Cornelius,Municipal,5/2/2000,Bond for parks and recreation,Bond,,"Open space, parks, recreation",3000000,1500000,3000000,1500000,yes,Pass,0.717638691,0.282361309,Mecklenburg County,,yes,7,397,1009,9553,3714700,,1406,1500000,1500000,,,NC
37,NC,37,Fuquay-Varina,Municipal,5/8/2007,Bond to purchase parks and recreational lands,Bond,,"Parks, recreation",2000000,2000000,2000000,2000000,yes,Pass,0.791862285,0.208137715,Wake County,,yes,7,133,506,9568,3725300,,639,2000000,2000000,,,NC
37,NC,37,Raleigh,Municipal,10/9/2007,Bond for park acquisition and greenway improvements,Bond,,"Parks, greenways",88600000,39888721,88600000,39888721,yes,Pass,0.723951692,0.276048308,,TPL,yes,7,7360,19302,9570,3755000,,26662,39888721,39888721,,,NC
37,NC,37,Wake County,County,10/9/2007,Bond for open space preservation,Bond,,Open space,50000000,50000000,50000000,50000000,yes,Pass,0.714155777,0.285844223,Question 3,TPL,yes,5,15399,38473,9588,37183,37183,53872,50000000,50000000,,,NC
37,NC,37,Mecklenburg County,County,11/6/2007,Bond for the purchase of open space,Bond,,"Open space, greenways",35640000,33990000,35640000,33990000,yes,Pass,0.638199635,0.361800365,,"TPL, TCC",yes,5,44822,79064,9592,37119,37119,123886,33990000,33990000,,,NC
37,NC,37,Belmont,Municipal,11/6/2007,Bond for parks and recreation including land acquisition,Bond,,"Parks, recreation, trails",12000000,2700000,12000000,2700000,yes,Pass,0.685675492,0.314324508,Gaston County,,yes,7,463,1010,9624,3704840,,1473,2700000,2700000,,,NC
37,NC,37,Lewisville,Municipal,11/6/2007,Advisory measure to determine if Town funds including property tax should be used for parkland acquisition ,Other,Advisory Measure,"Parks, recreation",,,,,no,Fail,0.438596491,0.561403509,"Advisory Measure, Forsyth County",,no,7,864,675,9634,3738040,,1539,0,0,,,NC
37,NC,37,Clayton,Municipal,5/6/2008,Bond for parks and recreation,Bond,,"Parks, recreation",4000000,2000000,4000000,2000000,yes,Pass,0.74249758,0.25750242,Johnston County,TPL,yes,7,798,2301,9677,3712860,,3099,2000000,2000000,,,NC
37,NC,37,Guilford County,County,5/6/2008,Bond for park development and greenways,Bond,,"Parks, recreation, greenways",20200000,4000000,,,no,Fail,0.477559647,0.522440353,,,yes,5,64268,58747,9685,37081,37081,123015,0,4000000,,,NC
37,NC,37,Mecklenburg County,County,11/4/2008,"Bond for parks, recreation, and land acquisition",Bond,,"Parks, recreation, open space, trails",250000000,60000000,250000000,60000000,yes,Pass,0.616815492,0.383184508,,TCC,yes,5,144528,232648,9713,37119,37119,377176,60000000,60000000,,,NC
37,NC,37,Gastonia,Municipal,5/4/2010,Bond for parks and recreational improvements,Bond,,"Parks, recreation, trails, greenways",4635000,1000000,,,no,Fail,0.487898089,0.512101911,Gaston County,,yes,7,2412,2298,9845,3725580,,4710,0,1000000,,,NC
37,NC,37,Holly Springs,Municipal,11/8/2011,Bond for park acquisition and improvements,Bond,,"Open space, greenways, recreation, parks",20000000,8500000,20000000,8500000,yes,Pass,0.592022117,0.407977883,Wake County,,yes,7,1033,1499,9921,3732260,,2532,8500000,8500000,,,NC
37,NC,37,Raleigh,Municipal,11/4/2014,Bond for parks and recreational facilities,Bond,,"Parks, recreation, trails",91775000,10000000,91775000,10000000,yes,Pass,0.680170148,0.319829852,Wake County,,yes,7,41504,88265,10065,3755000,,129769,10000000,10000000,,,NC
37,NC,37,Asheville,Municipal,11/8/2016,Bond for parks and recreation,Bond,,"Parks, recreation, trails, open space",17000000,2000000,17000000,2000000,yes,Pass,0.769710648,0.230289352,Buncombe County,,yes,7,10816,36151,10250,3702140,,46967,2000000,2000000,,,NC
37,NC,37,Charlotte,Municipal,11/8/2016,Bond for trails and greenways including the Carolina Thread Trail,Bond,,"Trails, open space, greenways, parks, recreation",55000000,25000000,55000000,25000000,yes,Pass,0.778598183,0.221401817,Mecklenburg County,,yes,7,76193,267946,10252,3712000,,344139,25000000,25000000,,,NC
38,ND,38,North Dakota,State,11/4/2014,"25-year, dedication of 5 percent the oil and gas extraction tax to protect clean water, wildlife habitat and parks",Other,Oil and gas extraction tax,"Open space, parks, trails, recreation, watershed protection, wildlife habitat, farmland, forests",1875000000,1875000000,,,no,Fail,0.206209176,0.793790824,"Constitutional Amendment Measure 5, Citizen petition",,yes,2,199305,51775,10087,38,38,251080,0,1875000000,,,ND
31,NE,31,Lincoln,Municipal,5/9/2006,Bond for the purchase of land for a linear park in the city,Bond,,"Parks, recreation, open space",2700000,2700000,,,no,Fail,0.454423566,0.545576434,,,yes,7,28077,23386,9311,3128000,,51463,0,2700000,,,NE
31,NE,31,Nebraska,State,11/3/1992,Constitutional Amendment establishing the Nebraska State Lottery with 49.5 percent of the proceeds dedicated to the Nebraska Environmental Trust Fund,Other,Lottery proceeds,"Open space, wildlife habitat, watershed protection",600000000,297000000,600000000,297000000,yes,Pass,0.622051598,0.377948402,THe funding allocation was passed prior to the election.  In 2004 voters approved a new funding allocation which changed the Environmental Trust portion to 44.5% from 49.5%,,yes,2,267928,440973,10011,31,31,708901,297000000,297000000,,,NE
33,NH,33,Amherst,Municipal,3/13/2001,Town Meeting vote to dedicate 50% of land use tax for conservation of recreation land purchases,Property tax,,recreation,1960000,1960000,1960000,1960000,yes,Pass,0.664358721,0.335641279,TOWN MEETING,,no,10,1018,2015,6457,3301101300,,3033,1960000,1960000,,,NH
33,NH,33,North Hampton,Municipal,3/14/2001,Town Meeting vote to approve a bond for acquisition of conservation land,Bond,,open space,4000000,4000000,4000000,4000000,yes,Pass,,,town meeting 100/0,,no,10,,,6458,3301554580,,,4000000,4000000,,,NH
33,NH,33,Amherst,Municipal,3/12/2002,Bond to acquire 47-acre parcel,Bond,,open space,400000,400000,400000,400000,yes,Pass,0.636085627,0.363914373,,,no,10,1071,1872,6459,3301101300,,2943,400000,400000,,,NH
33,NH,33,Amherst,Municipal,3/12/2002,Bond to acquire 123-acre parcel,Bond,,open space,442000,442000,442000,442000,yes,Pass,0.640667575,0.359332425,,,no,10,1055,1881,6460,3301101300,,2936,442000,442000,,,NH
33,NH,33,Brookline,Municipal,3/12/2002,Bond for open space acquisition,Bond,,open space,1000000,1000000,1000000,1000000,yes,Pass,0.833333333,0.166666667,Town meeting,,no,10,45,225,6462,3301108100,,270,1000000,1000000,,,NH
33,NH,33,Hampton,Municipal,3/12/2002,Bond for land conservation,Bond,,open space,3000000,3000000,,,no,Fail,0.400759013,0.599240987,,,no,10,1579,1056,6463,3301533060,,2635,0,3000000,,,NH
33,NH,33,Stratham,Municipal,3/12/2002,Bond to acquire land for conservation,Bond,,open space,5000000,5000000,5000000,5000000,yes,Pass,0.88,0.12,,,no,10,63,462,6464,3301574340,,525,5000000,5000000,,,NH
33,NH,33,Hollis,Municipal,3/12/2002,Bond for open space acquisition,Bond,,open space,3500000,3500000,3500000,3500000,yes,Pass,0.73151751,0.26848249,,,no,10,69,188,6465,3301137140,,257,3500000,3500000,,,NH
33,NH,33,Londonderry,Municipal,3/12/2002,Bond for open space acquisition,Bond,,open space,1000000,1000000,1000000,1000000,yes,Pass,0.722313709,0.277686291,,,no,10,1349,3509,6466,3301543220,,4858,1000000,1000000,,,NH
33,NH,33,Merrimack,Municipal,3/12/2002,"Bond to acquire open space, forest and wetlands",Bond,,"Open space, forests, watershed protection",4200000,4200000,4200000,4200000,yes,Pass,0.67028754,0.32971246,,,no,10,2064,4196,6467,3301147540,,6260,4200000,4200000,,,NH
33,NH,33,Newfields,Municipal,3/12/2002,"Bond to acquire land for conservation, for open space",Bond,,open space,2000000,2000000,2000000,2000000,yes,Pass,0.888888889,0.111111111,Town Meeting,,no,10,14,112,6468,3301551380,,126,2000000,2000000,,,NH
33,NH,33,Newmarket,Municipal,5/1/2002,Bond to acquire land for open space and recreation,Bond,,"Open space, recreation",2000000,2000000,2000000,2000000,yes,Pass,0.699367089,0.300632911,,,no,10,380,884,6469,3301552340,,1264,2000000,2000000,,,NH
33,NH,33,Rindge,Municipal,3/11/2003,Bond to buy acre parcel for open space (2/3 req.),Bond,,open space,225000,225000,225000,225000,yes,Pass,0.864942529,0.135057471,,,no,10,47,301,6470,3300564580,,348,225000,225000,,,NH
33,NH,33,Londonderry,Municipal,3/11/2003,"Bond for open space, public facilities (2/3 req.)",Bond,,open space,10700000,10700000,10700000,10700000,yes,Pass,0.693747147,0.306252853,,,no,10,671,1520,6471,3301543220,,2191,10700000,10700000,,,NH
33,NH,33,Hampton,Municipal,3/11/2003,"Bond for conservation easements, open space (3/5 req.)",Bond,,open space,4000000,4000000,,,no,Fail,0.564255038,0.435744962,Requires 2/3 vote,,no,10,1319,1708,6472,3301533060,,3027,0,4000000,,,NH
33,NH,33,Exeter,Municipal,3/11/2003,"Bond for conservation easements, open space (3/5 req.)",Bond,,open space,3000000,3000000,3000000,3000000,yes,Pass,0.73456057,0.26543943,,,no,10,894,2474,6473,3301525380,,3368,3000000,3000000,,,NH
33,NH,33,Durham,Municipal,3/11/2003,"Bond for conservation easements, open space",Bond,,open space,2500000,2500000,2500000,2500000,yes,Pass,0.767022697,0.232977303,,,no,10,349,1149,6474,3301719700,,1498,2500000,2500000,,,NH
33,NH,33,Barrington,Municipal,3/11/2003,"Bond for conservation easements, open space",Bond,,open space,1000000,1000000,,,no,Fail,0.406177606,0.593822394,,,no,10,769,526,6475,3301703460,,1295,0,1000000,,,NH
33,NH,33,Salem,Municipal,3/11/2003,Bond for open space (2/3 req.),Bond,,open space,1000000,1000000,,,no,Fail,0.657007688,0.342992312,Requires 2/3 vote,,no,10,1160,2222,6476,3301566660,,3382,0,1000000,,,NH
33,NH,33,Rye,Municipal,3/11/2003,"Bond for open space, conservation easements",Bond,,open space,5000000,5000000,5000000,5000000,yes,Pass,0.727702304,0.272297696,,,no,10,461,1232,6477,3301566180,,1693,5000000,5000000,,,NH
33,NH,33,Hampton,Municipal,3/9/2004,"Article 2, Bond for farmland easements",Bond,,Farmland,3000000,3000000,3000000,3000000,yes,Pass,0.743868027,0.256131973,,"TPL, TCC",no,10,1180,3427,7022,3301533060,,4607,3000000,3000000,,,NH
33,NH,33,Hampton,Municipal,4/8/1997,"Budget Allocation for Acquisition of Parcel for Conservation, Recreation (2/3 vote required)",Other,Budget allocation,"Recreation, open space",185000,185000,,,no,Fail,0.652600297,0.347399703,"(2/3 vote required), Town meeting",,no,7,1169,2196,7115,3332980,,3365,0,185000,,,NH
33,NH,33,Amherst,Municipal,3/9/2004,Bond to purchase open space lands or other property for conservation or recreatioanl needs,Bond,,"Open space, recreation",5500000,5500000,,,no,Fail,0.594659363,0.405340637,60% required,,no,10,1184,1737,7448,3301101300,,2921,0,5500000,,,NH
34,NJ,34,Mount Laurel Township,Municipal,11/5/2002,"4¢ per $100 property tax increase for open space, parks and recreation lands, historic preservation, farmland",Property tax,,"open space, recreation, farmland",25591320,25591320,25591320,25591320,yes,Pass,0.687562388,0.312437612,Burlington co,,yes,10,3130,6888,6478,3400549020,,10018,25591320,25591320,,,NJ
34,NJ,34,New Providence Borough,Municipal,11/5/2002,"1¢ per $100 property tax increase for open space, parks",Property tax,,"open space, parks",2661100,2661100,2661100,2661100,yes,Pass,0.661389961,0.338610039,Union Co,,yes,10,877,1713,6479,3403951810,,2590,2661100,2661100,,,NJ
34,NJ,34,Monroe Township,Municipal,11/5/2002,"1¢ per $100 property tax increase for open space, farmland, recreation lands, historic preservation, conservation (non-binding)",Property tax,,"open space, recreation, farmland",8000000,8000000,8000000,8000000,yes,Pass,0.682128628,0.317871372,Middlesex Co,,yes,10,3351,7191,6480,3402347280,,10542,8000000,8000000,,,NJ
34,NJ,34,Monmouth County,County,11/5/2002,"1¢ per $100 property tax increase for open space, farmland, recreation land (non-binding)",Property tax,,"open space, farmland, recreation",120000000,120000000,120000000,120000000,yes,Pass,0.73070075,0.26929925,,,yes,5,33880,91928,6481,34025,34025,125808,120000000,120000000,,,NJ
34,NJ,34,Middletown Township,Municipal,11/5/2002,"1¢ per $100 property tax increase for open space, parkland, farmland, recreation land (non-binding)",Property tax,,"open space, parks, farmland, recreation",9701540,9701540,9701540,9701540,yes,Pass,0.585147792,0.414852208,Monmouth Co,,yes,10,6821,9621,6482,3402545990,,16442,9701540,9701540,,,NJ
34,NJ,34,Mansfield Township,Municipal,11/5/2002,1¢ per $100 property tax increase for open space,Property tax,,open space,2477400,2477400,2477400,2477400,yes,Pass,0.567172569,0.432827431,Warren Co,,yes,10,770,1009,6483,3404143320,,1779,2477400,2477400,,,NJ
34,NJ,34,Peapack-Gladstone Borough,Municipal,11/5/2002,"1¢ per $100 property tax increase for open space, recreation lands, farmland, historic preservation",Property tax,,"Open space, recreation, farmland",1686140,1686140,1686140,1686140,yes,Pass,0.741590214,0.258409786,Somerset Co,,yes,7,169,485,6484,3457300,,654,1686140,1686140,,,NJ
34,NJ,34,Pittsgrove Township,Municipal,11/5/2002,"Up to 5¢ per $100 property tax increase for open space, farmland conservation easements (non-binding)",Property tax,,"Open space, farmland",300000,300000,,,no,Fail,0.466840537,0.533159463,Salem Co,,yes,10,1431,1253,6485,3403359130,,2684,0,300000,,,NJ
34,NJ,34,South Brunswick Township,Municipal,11/5/2002,Up to 1.5¢ per $100 property tax increase for open space and amend law to allow .5¢ per $100 for historic preservation,Property tax,,"Open space, recreation, farmland",15800000,15800000,15800000,15800000,yes,Pass,0.532950888,0.467049112,Middlesex Co,,yes,10,3338,3809,6486,3402368790,,7147,15800000,15800000,,,NJ
34,NJ,34,Warren County,County,11/5/2002,2¢ per $100 property tax increase for open space,Property tax,,Open space,39060040,39060040,39060040,39060040,yes,Pass,0.595982701,0.404017299,,,yes,5,11304,16675,6487,34041,34041,27979,39060040,39060040,,,NJ
34,NJ,34,Woolwich Township,Municipal,11/5/2002,"4¢ per $100 property tax increase for open space, farmland (non-binding)",Property tax,,"open space, farmland",829160,829160,829160,829160,yes,Pass,0.540999057,0.459000943,Gloucester Co,,yes,10,487,574,6488,3401582840,,1061,829160,829160,,,NJ
34,NJ,34,Milltown Borough,Municipal,11/5/2002,"1¢ per $100 property tax increase for open space, recreation lands, conservation",Property tax,,"open space, recreation",1060000,1060000,,,no,Fail,0.488361266,0.511638734,Middlesex Co,,yes,10,1099,1049,6489,3402346620,,2148,0,1060000,,,NJ
34,NJ,34,Monroe Township,Municipal,11/4/2003,"2 cents per $100 property tax for open space, recreation",Property tax,,"open space, recreation",4840000,4840000,4840000,4840000,yes,Pass,0.502631066,0.497368934,Gloucester Co.,,yes,10,2552,2579,6490,3401547250,,5131,4840000,4840000,,,NJ
34,NJ,34,Montvale Borough,Municipal,11/4/2003,"Municipal Question 2, 5-year, .5 cent per $100 property tax renewal for open space, recreation",Property tax,,"open space, recreation",273100,273100,273100,273100,yes,Pass,0.529965753,0.470034247,Bergen co,,yes,10,549,619,6491,3400347610,,1168,273100,273100,2008,,NJ
34,NJ,34,North Hanover Township,Municipal,11/4/2003,"5-year, 2 cents per $100 property tax increase for farmland, open space",Property tax,,"farmland, open space",206432,206432,206432,206432,yes,Pass,0.538865546,0.461134454,Burlington Co,,yes,10,439,513,6492,3400553070,,952,206432,206432,2008,,NJ
34,NJ,34,Northvale Borough,Municipal,11/4/2003,"Municipal Question, 5-year, 1 cent per $100 property tax increase for open space, recreation",Property tax,,"open space, recreation",415000,415000,,,no,Fail,0.461654135,0.538345865,Bergen Co,,yes,10,358,307,6493,3400353430,,665,0,415000,,,NJ
34,NJ,34,Oakland Borough,Municipal,11/4/2003,"5-year, 1 cent per $100 property tax for open space, recreation, farmland, historic preservation",Property tax,,"open space, recreation, farmland",588250,588250,588250,588250,yes,Pass,0.62614601,0.37385399,Bergen Co,,yes,7,1101,1844,6494,3453850,,2945,588250,588250,2008,,NJ
34,NJ,34,Park Ridge Borough,Municipal,11/4/2003,"5-year, 1 cent per $100 property tax increase for open space, recreation, farmland, historic preservation",Property tax,,"open space, recreation, farmland",940000,940000,940000,940000,yes,Pass,0.539855072,0.460144928,Bergen Co,,yes,10,635,745,6495,3400356130,,1380,940000,940000,2008,,NJ
34,NJ,34,Pilesgrove Township,Municipal,11/4/2003,"3 cents per $100 property tax increase for open space, natural areas, sensitive habitats, water resources, greenways, recreation, trails",Property tax,,"open space, wildlife habitat, watershed protection, greenways, recreation, trails",1424501,1424501,1424501,1424501,yes,Pass,0.721068249,0.278931751,Salem Co,,yes,10,376,972,6496,3403358530,,1348,1424501,1424501,,,NJ
34,NJ,34,Pittsgrove Township,Municipal,11/4/2003,"2.5 cents per $100 property tax increase for open space, farmland, natural areas, water resources",Property tax,,"Open space, famland, watershed protection",1425802,1425802,1425802,1425802,yes,Pass,0.559419014,0.440580986,Salem Co,,yes,10,1001,1271,6497,3403359130,,2272,1425802,1425802,,,NJ
34,NJ,34,Voorhees Township,Municipal,11/4/2003,"Municipal Question, 3.5 cents per $100 property tax increase for open space, farmland, water quality",Property tax,,"open space, farmland",11200000,11200000,11200000,11200000,yes,Pass,0.683597621,0.316402379,Camden Co,"TPL, TCC",yes,10,1277,2759,6498,3400776220,,4036,11200000,11200000,,,NJ
34,NJ,34,Wharton Borough,Municipal,11/4/2003,"2 cents per $100 property tax increase for open space, recreation",Property tax,,"Open space, recreation",683052,683052,683052,683052,yes,Pass,0.642052566,0.357947434,Morris Co,,yes,10,286,513,6499,3402780390,,799,683052,683052,,,NJ
34,NJ,34,Weymouth Township,Municipal,11/4/2003,1 cent per $100 property tax for open space,Property tax,,open space,180000,180000,180000,180000,yes,Pass,0.671641791,0.328358209,Atlantic Co.,,yes,10,154,315,6500,3400180330,,469,180000,180000,,,NJ
34,NJ,34,West Milford Township,Municipal,11/4/2003,"1 cent per $100 property tax for open space, recreation, farmland, historic preservation",Property tax,,"open space, recreation, farmland",2950000,2950000,2950000,2950000,yes,Pass,0.502271867,0.497728133,Passaic Co.,,yes,10,2629,2653,6501,3403179460,,5282,2950000,2950000,,,NJ
34,NJ,34,West Cape May Borough,Municipal,11/4/2003,"Referendum 1, 1 cent per $100 property tax for open space, farmland",Property tax,,"open space, farmland",336296,336296,,,no,Fail,0.498795181,0.501204819,Cape May Co.,,yes,10,208,207,6502,3400978530,,415,0,336296,,,NJ
34,NJ,34,Wayne Township,Municipal,11/4/2003,"2 cents per $100 property tax for open space, recreation, farmland, historic preservation",Property tax,,"open space, recreation, farmland",21261360,21261360,21261360,21261360,yes,Pass,0.60744803,0.39255197,Passaic Co.,,yes,10,3078,4763,6503,3403177840,,7841,21261360,21261360,,,NJ
34,NJ,34,Waldwick Borough,Municipal,11/4/2003,"10-year, .5 cent per $100 property tax increase for open space",Property tax,,Open space,340514,340514,340514,340514,yes,Pass,0.528600613,0.471399387,Bergen Co,,yes,10,923,1035,6504,3400376400,,1958,340514,340514,2013,,NJ
34,NJ,34,Bergen County,County,11/4/2003,"County Public Question, 1 cent per $100 property tax for open space, recreation, farmland and historic preservation",Property tax,,"open space, recreation, farmland",214000000,214000000,214000000,214000000,yes,Pass,0.596895953,0.403104047,,TPL,yes,5,51582,76380,6505,34003,34003,127962,214000000,214000000,,,NJ
34,NJ,34,Blairstown Township,Municipal,11/4/2003,"2 cents per $100 property tax increase for open space, recreation, farmland",Property tax,,"open space, recreation, farmland",1800000,1800000,1800000,1800000,yes,Pass,0.55794948,0.44205052,Warren Co.,,yes,10,595,751,6506,3404106160,,1346,1800000,1800000,,,NJ
34,NJ,34,Chester Borough,Municipal,11/4/2003,"2 cents per $100 property tax increase for open space, recreation",Property tax,,"open space, recreation",3769260,3769260,3769260,3769260,yes,Pass,0.522033898,0.477966102,Morris Co.,,yes,10,141,154,6507,3402712580,,295,3769260,3769260,,,NJ
34,NJ,34,Clifton,Municipal,11/4/2003,"Public Question, 7-year, .75 cent per $100 property tax to preserve open space, recreation",Property tax,,"open space, recreation",2726420,2726420,,,no,Fail,0.483247072,0.516752928,Passaic Co.,,yes,10,3794,3548,6508,3403113690,,7342,0,2726420,,,NJ
34,NJ,34,Cresskill Borough,Municipal,11/4/2003,"Municipal Question 1, 1 cent per $100 property tax for open space, farmland, historic preservation",Property tax,,"open space, farmland",1660000,1660000,1660000,1660000,yes,Pass,0.658499234,0.341500766,Bergen Co,,yes,10,446,860,6509,3400315820,,1306,1660000,1660000,,,NJ
34,NJ,34,Denville Township,Municipal,11/4/2003,"Municipal Public Question, 2 cents per $100 property tax increase for open space, recreation, farmland, historic preservation",Property tax,,"open space, recreation, farmland",8249588,8249588,8249588,8249588,yes,Pass,0.618834081,0.381165919,Morris Co,,yes,10,1020,1656,6510,3402717650,,2676,8249588,8249588,,,NJ
34,NJ,34,East Greenwich Township,Municipal,11/4/2003,"Public Question, 2 cents per $100 property tax increase for open space, recreation, farmland, historic preservation",Property tax,,"open space, recreation, farmland",1398028,1398028,1398028,1398028,yes,Pass,0.569874932,0.430125068,Gloucester Co,,yes,10,791,1048,6511,3401519180,,1839,1398028,1398028,,,NJ
34,NJ,34,Franklin Township,Municipal,11/4/2003,"Municipal Public Question 1, Bond for acquisition of open space parcel",Bond,,open space,3300000,3300000,3300000,3300000,yes,Pass,0.543809524,0.456190476,Hunterdon Co,,yes,10,479,571,6512,3401924870,,1050,3300000,3300000,,,NJ
34,NJ,34,Frelinghuysen Township,Municipal,11/4/2003,1 cent per $100 property tax increase for farmland preservation,Property tax,,farmland,320000,320000,320000,320000,yes,Pass,0.602105263,0.397894737,Warren Co,,yes,10,189,286,6513,3404125320,,475,320000,320000,,,NJ
34,NJ,34,Greenwich Township,Municipal,11/4/2003,"1 cent per $100 property tax increase for open space, drinking water, recreation, farmland, historic preservation",Property tax,,"open space, recreation, farmland",1027991,1027991,1027991,1027991,yes,Pass,0.641805692,0.358194308,Warren Co,,yes,10,365,654,6514,3404128260,,1019,1027991,1027991,,,NJ
